idn,akz,bbg,standort,signatur_g,signatur_a,jahr,titel,stuecktitel,f4243,f4256,f4241,f4105_9,f4105_g,ausleihcode,sig_komm,f4801_a,f4801_k,bibliothek,einrichtung,exemplar
994569319,L-1821-15664102X,Aal,DBSM/F/Bö,Bö F III 362,Bö F III 362,1821,A @list of editions of the Bible and parts thereof in English : from the year 1505 - 1820 ; with an appendix containing specimens of translations and , : ,,,,,,,,,,,1,02
994572131,L-1817-156644711,Aal,DBSM/F/Bö,Bö G II 386,Bö G II 386,1817,"Elogium Johannis Meermanni, auctore Henrico Constantino Cras : ", : ,,,,,,,,,,,1,02
994577648,L-1820-156875403,Aal,DBSM/F/Bö,Bö B III 358,Bö B III 358,1820,"Cowie's printer's pocket-book and manual, containing the compositors' and pressmen's scale of prices, aggreed upon in 1810 and modified in 1816:  ... ", : ,,,,,,,,,,,1,02
994577915,L-1705-156875683,Aal,DBSM/F/Bö,Bö F I 90,Bö F I 90,1705,"Thomae Crenii de Singularibus scriptorum dissertatio epistolica ad ... Mauricium Georgium Weidmannum, Lipsiensem : ", : ,,,,,,,,Schenkung Kirchhoff,,,1,02
994578091,L-1559-15687587X,Aal,DBSM/F/Bö,Bö B I 345,Bö B I 345,1559,La|| @Vera Maniera|| del Scriver Corsivo|| Cancellaresco : , : ,,,,,,,,S. 32 handschr. dat.: Romae ... 1559,,,1,02
994578296,L-1570-156876035,Aal,DBSM/F/Bö,Bö C VII 482/2°,Bö C VII 482/2°,1570,"Histoire des vrays tesmoins de la verité de l'Evangile, qui de leur sang l'ont signée, depuis Jean Hus iusques au temps present : Comprinse en 8 livre", : ,,,,,,,,,,,1,02
994579004,L-1820-15687671X,Aal,DBSM/F/Bö,Bö E IV 1139,Bö E IV 1139,1820,"Opinion de [Anselme] Crignon d'Auzouer [Ouzouer], député du Loiret, sur l'amendement proposé par M. Josse-Beauvoir, de soumettre les pamphlets à la ce", : ,,,,,,,,,,,1,02
99457925X,L-1794-15687718X,Aal,DBSM/F/Bö,Bö G I 39,Bö G I 39,1794,Ueber die Kieler Universitätsbibliothek : , : ,,,,,,,,,,,1,02
994580118,L-1651-156877937,Aal,DBSM/F/Bö,Bö D VII 879,Bö D VII 879,1651,"Catalogus operum Jacobi Sirmondi, digestus in ordinem temporum, quo sunt excusa sumtibus Sebastiani Cramoisy : ", : ,,,,,,,,"Mit hs. Ergänzen. d. Leipziger Antiquars Thiermann, um 1780",,,1,02
994593015,L-1733-15689145X,Aal,DBSM/F/Bö,Bö G II 332,Bö G II 332,1733,"Bibliotheca Cyprianica, sive catalogus librorum historico-theologicorum, quos Ernestus Salomo Cyprianus ... sibi ... conquisivit ; Editio auctior ... ", : ,,,,,,,,,,,1,02
994593309,L-1714-156891662,Aal,DBSM/F/Bö,Bö G II 229,Bö G II 229,1714,Catalogus codicum manuscriptorum Bibliothecae Gothanae : , : ,,,,,,,,In zeitgenöss. Einbd. aus marmoriertem Leder,,,1,02
994643047,L-1720-15718370X,Aal,DBSM/F/Bö,Bö B II 25,Bö B II 25,1720,Programma de charta eximio numinis benignissimi dono : , : ,,,,,,,,,,,1,02
994643209,L-1799-157183874,Aal,DBSM/F/Bö,Bö F III 248,Bö F III 248,1799,"Catalogo dos livros, que se haõ de ler para a continuaçaõ do diccionario da lingua portugueza : Mandado publicar dela Academia Real das sciencias de L", : ,,,,,,,,,,,1,02
994643454,L-1588-157184129,Afl,DBSM/F/Bö,Bö B I 349,Bö B I 349,1588,La @notomia delle Cancellaresche corsiue & altre Maniere di Lettere,2 : ,,,,,,,,"Taf. 2, 14 u. 37 fehlen",,,1,02
994643535,L-1593-157184188,Afl,DBSM/F/Bö,Bö B I 349,Bö B I 349,1593,La @notomia delle Cancellaresche corsiue & altre Maniere di Lettere,3. : Il Teatro delle Cancellaresche corsiue per Secretari et altre maniere di Lettere,,,,,,,,"Taf. 2, 5 u. 38 fehlen",,,1,02
994645228,L-1788-157185516,Aal,DBSM/F/Bö,Bö D VII 1056,Bö D VII 1056,1788,"Vente à l'amiable, de livres en tous genres, très-bien conditionnés, qui se fera le mardi 4 mars 1788, et jours suivants, jusqu'au samedi 15 du même m", : ,,,,,,,,,,,1,02
994656955,L-1710-157197255,Aal,DBSM/F/Bö,Bö F III 342,Bö F III 342,1710,Schauplatz Der Masquirten und Demasquirten Gelehrten bey ihren verdeckten und nunmehro entdeckten Schriften ... : , : ,,,,,,,,,,,1,02
994670672,L-1827-157500896,Aal,DBSM/F/Bö,Bö E IV 1157/4°,Bö E IV 1157/4°,1827,Notations statistiques pour servir à la discussion des lois sur la presse : , : ,,,,,,,,,,,1,02
994687230,L-1681-157519538,Aal,DBSM/F/Bö,Bö G II 4,Bö G II 4,1681,"Johannis Deckerri, ... De scriptis adespotis, pseudepigraphis, et supposititiis, Conjecturae : ", : ,,,,,,,,,,,1,02
994687370,L-1686-157519775,Aal,DBSM/F/Bö,Bö F III 327,Bö F III 327,1686,"Johannis Deckerri, ... De scriptis adespotis, pseudepigraphis, et suppositiis Conjecturae : Cum additionibus variorum", : ,,,,,,,,,,,1,02
994692536,L-1926-157567451,Aal,DBSM/F/Bö,Bö E IV 26,Bö E IV 26,1626,"Decretvm Vniversitatis Generalis Studii Pictaviensis [in librum] Antonii Sanctarelli [""Tractatus de haeresii, schismate, apostasia, ..."" Romae 1625] ;", : ,,,,,,,,,,,1,02
994692552,L-1626-157567478,Aal,DBSM/F/Bö,Bö E IV 27,Bö E IV 27,1626,Decretum Vniversitatis Parisiensis : [in theses propositas et publice defensas a F. Ioanne Testefort e familia Dominicanorum] ; anno ... 1626 [3.12.], : ,,,,,,,,,,,1,02
994692579,L-1626-157567486,Aal,DBSM/F/Bö,Bö E IV 28,Bö E IV 28,1626,"Decretum Vniversitatis Valentinae [de libro Antonij Sanctarelli Societatis Jesu ""Tractatus de Haeresii, Schismatii, Apostasia, ..."" Romae 1625] : Anno", : ,,,,,,,,,,,1,02
994692595,L-1763-157567591,Afl,DBSM/F/Bö,Bö F III 781,Bö F III 781,1763,Bibliographie instructive ou traité de la conaissance des livres rares et singuliers ...,1. : Théologie,,,,,,,,,,,1,03
994692625,L-1764-157567613,Afl,DBSM/F/Bö,Bö F III 781,Bö F III 781,1764,Bibliographie instructive ou traité de la conaissance des livres rares et singuliers ...,2/3. : Jurisprudence et des sciences et arts,,,,,,,,,,,1,03
994692633,L-1765-15756763X,Afl,DBSM/F/Bö,Bö F III 781,Bö F III 781,1765,Bibliographie instructive ou traité de la conaissance des livres rares et singuliers ...,"4., T. 1 : Belles lettres, ",", ",,,,,,,,,,1,03
99469265X,L-1768-157567656,Afl,DBSM/F/Bö,Bö F III 781,Bö F III 781,1768,Bibliographie instructive ou traité de la conaissance des livres rares et singuliers ...,"5., T. 1 : Histoire, ",", ",,,,,,,,,,1,03
994692706,L-1675-157567664,Aal,DBSM/F/Bö,Bö B II 248,Bö B II 248,1675,"Korte Deductie, dienende tot aenwijsinge dat de nieuwe Impost op de consumptie van de Papieren, als mede op de gedruckte Papieren in de Provintie van ", : ,,,,,,,,,,,1,02
994692757,L-1768-15756780X,Afl,DBSM/F/Bö,Bö F III 781,Bö F III 781,1768,Bibliographie instructive ou traité de la conaissance des livres rares et singuliers ...,"5., T. 2 : Histoire, ",", ",,,,,,,,,,1,03
994692773,L-9999-157567834,Afl,DBSM/F/Bö,Bö F III 781,Bö F III 781,1768,Bibliographie instructive ou traité de la conaissance des livres rares et singuliers ...,"5., T. 3 : Histoire, ",", ",,,,,,,,,,1,03
994692803,L-1750-157567818,Aal,DBSM/F/Bö,Bö C V 815,Bö C V 815,1750,Défense des libraires hollandois contre les Mensonges imprimez de Mr. de Voltaire : , : ,,,,,,,,,,,1,02
99469282X,L-1769-157567885,Afl,DBSM/F/Bö,Bö F III 781,Bö F III 781,1769,Bibliographie instructive ou traité de la conaissance des livres rares et singuliers ...,"Suppl. 1. : Supplement, ou catalogue les livres du cabinet de feu M. Louis Jean Gaignat",,,,,,,,,,,1,02
994692854,L-1769-157567915,Afl,DBSM/F/Bö,Bö F III 781,Bö F III 781,1769,Bibliographie instructive ou traité de la conaissance des livres rares et singuliers ...,"Suppl. 2. : Supplement, ou catalogue les livres du cabinet de feu M. Louis Jean Gaignat",,,,,,,,,,,1,02
994693214,L-1772-157568423,Aal,DBSM/F/Bö,Bö B I 351/2°,Bö B I 351/2°,1772,Ammaestramenti Teorieopratici Indirizzati ad agevolare il modo d'imparare da per se La Scrittura Moderna : , : ,,,,,,,,Ausg. ohne Portr.,,,1,02
994693214,L-1772-157568458,Aal,DBSM/F/Bö,Bö B I 351 a/2°,Bö B I 351 a/2°,1772,Ammaestramenti Teorieopratici Indirizzati ad agevolare il modo d'imparare da per se La Scrittura Moderna : , : ,,,,,,,,Ausg. ohne Portr.,,,1,03
994693214,L-1772-157568520,Aal,DBSM/F/Bö,Bö B I 351 b/2°,Bö B I 351 b/2°,1772,Ammaestramenti Teorieopratici Indirizzati ad agevolare il modo d'imparare da per se La Scrittura Moderna : , : ,,,,,,,,,,,1,04
994697627,L-1829-157573362,Afl,DBSM/F/Bö,Bö E IV 147,Bö E IV 147,1829,"Histoire de la détention des philosophes et des gens de lettres à la Bastille et à Vincennes, précédée de celle de Foucquet, de Pellisson et de Lauzun",T. 1 : ,,,,,,,,Schenkung Kirchhoff,,,1,02
994697643,L-1829-157573389,Afl,DBSM/F/Bö,Bö E IV 147,Bö E IV 147,1829,"Histoire de la détention des philosophes et des gens de lettres à la Bastille et à Vincennes, précédée de celle de Foucquet, de Pellisson et de Lauzun",T. 2 : ,,,,,,,,Schenkung Kirchhoff,,,1,02
994697678,L-1829-157573427,Afl,DBSM/F/Bö,Bö E IV 147,Bö E IV 147,1829,"Histoire de la détention des philosophes et des gens de lettres à la Bastille et à Vincennes, précédée de celle de Foucquet, de Pellisson et de Lauzun",T. 3 : ,,,,,,,,Schenkung Kirchhoff,,,1,02
994698852,L-1829-15757489X,Aal,DBSM/F/Bö,Bö B I 334,Bö B I 334,1829,"Metodo di G. Carstairs, falsamente chiamato metodo Americano ossia l'arte d'imparare a scrivere o migliorare la scrittura in poche lezioni : ", : ,,,,,,,,,,,1,02
994698968,L-1818-157574970,Aal,DBSM/F/Bö,Bö B I 279,Bö B I 279,1818,"Elementos teórico-prácticos del arte de escribir por principios con las reglas generales, y particulares del carácter bastardo español : Dispuestas su", : ,,,,,,,,,,,1,02
994699069,L-1820-157575098,Aal,DBSM/F/Bö,Bö C IV 331,Bö C IV 331,1820,Dissertation sur l'art typographique contenant : un apperçu historique de ses progrès durant le XV et le XVI siècle et des recherches sur l'influence , : ,,,,,,,,,,,1,02
994706235,L-1791-157712605,Aal,DBSM/F/Bö,Bö B III 732,Bö B III 732,1791,"Neue, am 20sten Junius dieses Jahres gehaltene Deposition bei der Aufnahme eines neuen Kunstglieds zur Buchdrukkerei, von den dermaligen in der Stiebn", : ,,,,,,,,Stiftung Kirchhoff,,,1,02
994727291,L-1572-157751309,Aal,DBSM/F/Bö,Bö C VII 731/2°,Bö C VII 731/2°,1572,"Demosthenis et Aeschinis principum Graeciae oratorum opera, cum utriusq vita et Ulpiani commentarijs, nouisq scholiis ... graecolatina ... repurgata, ", : ,,,,,,,,,,,1,02
994733445,L-1789-157757390,Afl,DBSM/F/Bö,Bö F III 67/4°,Bö F III 67/4°,1789,Annalium typographicorum Michaelis Maittaire supplementum,P. 1 : ,,,,,,,,,,,1,02
994735200,L-1789-157759083,Afl,DBSM/F/Bö,Bö F III 67/4°,Bö F III 67/4°,1789,Annalium typographicorum Michaelis Maittaire supplementum,P. 2 : ,,,,,,,,,,,1,02
994737025,L-1782-157760812,Aal,DBSM/F/Bö,Bö C V 755,Bö C V 755,1782,"Bibliotheca typographica Vindobonensis : Ab anno 1482 ad annum 1560 ; In gratiam tōn bibliofilōn linguam Germanicam non callentium, ex magno, quod de ", : ,,,,,,,,Schenkung Kirchhoff,,,1,02
994740603,L-1811-157764931,Aal,DBSM/F/Bö,Bö F II 17,Bö F II 17,1811,Bibliomania or book madness : a bibliographical romance in 6 parts, : ,,,,,,,,Schenkung Kirchhoff,,,1,02
994741553,L-1817-157766217,Afl,DBSM/F/Bö,Bö B I 203,Bö B I 203,1817,The @bibliographical Decameron,1 : ,,,,,,,,,,,1,02
994741642,L-1817-157766276,Afl,DBSM/F/Bö,Bö B I 203,Bö B I 203,1817,The @bibliographical Decameron,2 : ,,,,,,,,,,,1,02
994741685,L-1817-157766365,Afl,DBSM/F/Bö,Bö B I 203,Bö B I 203,1817,The @bibliographical Decameron,3 : ,,,,,,,,,,,1,02
994742037,L-1817-157766888,Aal,DBSM/F/Bö,Bö B I 227,Bö B I 227,1817,"The @bibliographical Decameron; or, ten days pleasant discourse upon illuminated manuscripts : ", : ,,,,,,,,,,,1,02
994742584,L-1770-157767620,Aal,DBSM/F/Bö,Bö B III 1745/2°,Bö B III 1745/2°,1770,"Cartier, contenant 6 planches : [Explication de ces 6 planches, avec quelques détails particuliers de l'art, pour servir de supplément à l'article Car", : ,,,,,,,,,,,1,02
994750137,L-1770-157784886,Aal,DBSM/F/Bö,Bö B III 164/2°a,Bö B III 164/2°a,1770,Fonderie en caractères d'imprimerie : précédée de la gravure des poinçons, : ,,,,,,,,,,,1,02
994750137,L-1770-157784967,Aal,DBSM/F/Bö,Bö B III 164/2°b,Bö B III 164/2°b,1770,Fonderie en caractères d'imprimerie : précédée de la gravure des poinçons, : ,,,,,,,,,,,1,03
994750234,L-1770-157785084,Aal,DBSM/F/Bö,Bö B III 1013/2°,Bö B III 1013/2°,1770,"Gravure en lettres, en géographie et en musique : ", : ,,,,,,,,,,,1,02
994750447,L-1765-157785394,Aal,DBSM/F/Bö,Bö B III 1014/2°,Bö B III 1014/2°,1765,"Gravure, en taille-douce, en manière noire, manière de crayon, etc : Contenant 9 planches", : ,,,,,,,,,,,1,03
994751192,L-1770-157786080,Aal,DBSM/F/Bö,Bö B III 610/2°,Bö B III 610/2°,1770,Imprimerie en caractères : Contenant 19 planches, : ,,,,,,,,,,,1,02
994751435,L-1770-15778634X,Aal,DBSM/F/Bö,Bö B III 1698/2°,Bö B III 1698/2°,1770,Imprimerie en taille douce : [développement de la presse], : ,,,,,,,,,,,1,02
994753195,L-1770-157788296,Aal,DBSM/F/Bö,Bö B II 170/2°,Bö B II 170/2°,1770,Papeterie : contenant 14 planches, : ,,,,,,,,,,,1,03
994754191,L-1770-157789713,Aal,DBSM/F/Bö,Bö B II 22/2°,Bö B II 22/2°,1770,Parcheminier : contenant 7 planches, : ,,,,,,,,,,,1,03
994754981,L-1821-157790517,Aal,DBSM/F/Bö,Bö B III 106,Bö B III 106,1821,"Essai d'un nouveau caractère, offrant un essai lyrique de Pierre Didot, l'aîné : ", : ,,,,,,,,,,,1,02
994774834,L-1752-157824810,Aal,DBSM/F/Bö,Bö B I 390,Bö B I 390,1752,Dictionnaire portatif : dans lequel on a arrangé tous les Mots les plus usités de la Langue Françoise par Ordre Alphabétique ; Ce qui est d'un Grand s, : ,,,,,,,,,,,1,02
994778236,L-1752-157828565,Aal,DBSM/F/Bö,Bö F III 1311/2°,Bö F III 1311/2°,1752,Ad pium officium concionis atque recordationis funebris : memoriae publicae ... Johannis Davidis Baieri phil. et theol. doctoris ... hodie horis postm, : ,,,,,,,,,,,1,02
994795424,L-1700-157855244,Aal,DBSM/F/Bö,Bö H 152/4°,Bö H 152/4°,1700,"Privat-Acta, Herrn Carl Hildebrands von Dießkau zu Knauthayn gesuchte Concession undt Befreyung des Lumpensammlens [!] in der Stadt Leipzig und deren ", : ,,,,,,,,,,,1,02
994796374,L-1758-157856593,Aal,DBSM/F/Bö,Bö B III 733,Bö B III 733,1758,"Friederich Elias Dietzels einsichtliche Erfahrung der Buchdruckerey vom Jahre 1710 bis 1752 und deren nach und nach dabey eingeschlichenen Misbräuche,", : ,,,,,,,,,,,1,02
994801890,L-1771-157862763,Aal,DBSM/F/Bö,Bö B I 83/8°,Bö B I 83/8°,1771,"Dissertation historique sur l'invention des lettres, ou caractères d'écriture : sur les instrumens dont les anciens se sont servi pour écrire ; & sur ", : ,,,,,,,,,,,1,02
994801890,L-1771-157862771,Aal,DBSM/F/Bö,Bö B I 83a/8°,Bö B I 83a/8°,1771,"Dissertation historique sur l'invention des lettres, ou caractères d'écriture : sur les instrumens dont les anciens se sont servi pour écrire ; & sur ", : ,,,,,,,,,,,1,03
99481058X,L-1778-157874133,Aal,DBSM/F/Bö,Bö C IV 287,Bö C IV 287,1778,Discorso sullʹinvenzione della stampa esposto in nove qualità di caratteri esistenti nella Reale Stamperia di Cagliari : , : ,,,,,,,,Schenkung Kirchhoff,,,1,02
994814097,L-1797-157879917,Aal,DBSM/F/Bö,Bö C V 140,Bö C V 140,1797,Kurzgefaßte Nachricht von der noch unbekannten Buchdruckerey zu Altenberg in Böhmen : , : ,,,,,,,,,,,1,02
994816561,L-1672-157883019,Afl,DBSM/F/Bö,Bö C V 112/4°,Bö C V 112/4°,1672,Corpus Juris Saxonici,[Hauptw.] : ,,,,,,,,Zeitgen. Einband m. Blinddruck,,,1,02
994816707,L-1673-157883159,Afl,DBSM/F/Bö,Bö C V 112/4°,Bö C V 112/4°,1673,Corpus Juris Saxonici,Anh. : Appendix Corporis Juris Saxonici ...,,,,,,,,Zeitgen. Einband m. Blinddruck,,,1,02
994819293,L-1753-157885402,Aal,DBSM/F/Bö,Bö B III 969,Bö B III 969,1753,Scalptura : Carmen, : ,,,,,,,,,,,1,02
994819323,L-1753-15788807X,Aal,DBSM/F/Bö,Bö B III 969,Bö B III 969,1753,La @gravure : poe͏̈me, : ,,,,,,,,,,,1,02
994827962,L-1782-15811082X,Aal,DBSM/F/Bö,Bö C V 63,Bö C V 63,1782,Über die Einführung und Verbreitung der Buchdruckerkunst in Böhmen : , : ,,,,,,,,,,,1,02
994832923,L-1812-158115775,Aal,DBSM/F/Bö,Bö B III 891,Bö B III 891,1812,"L' @Imprimerie : Ode française et latine, dédiée au général baron de Pommereul, ... par Dondey-Dupré fils", : ,,,,,,,,,,,1,02
994839413,L-1760-158119800,Aal,DBSM/F/Bö,Bö C IV 138,Bö C IV 138,1760,Documenta typographicarum originum ex Argentinensibus tabulariis et bibliothecis : Nunc primum edita, : ,,,,,,,,,,,1,02
994842228,L-1730-15812314X,Afl,DBSM/F/Bö,Bö C V 605/2°,Bö C V 605/2°,1730,"Historische Nachricht von den Nürnbergischen Mathematicis und Künstlern, welche fast von dreyen Seculis her durch ihre Schriften u. Kunst-Bemühgn die ",T.1/2 : ,,,,,,,,Es fehlen nach d. Tit. die 4 Bl. Widmg. d. Verl. für Karl VI.,,,1,03
994845162,L-1795-158183002,Aal,DBSM/F/Bö,Bö E III 1111,Bö E III 1111,1795,Die @Dorfreise oder: So lernt man Menschen kennen : , : ,,,,,,,,,,,1,02
994848471,L-1784-158186397,Aal,DBSM/F/Bö,Bö H 54,Bö H 54,1784,"[Briefe geschäftlichen Inhalts von Prof. Anton Josef Dorsch in Mainz an die Hermann'sche Buchhandlung in Frankfurt a.M., 1784 - 1792] : [73 Orig.]", : ,,,,,,,,,,,1,02
994870019,L-1600-158237420,Aal,DBSM/F/Bö,Bö B I 675,Bö B I 675,1600,Der @Schreibfeder christliches Lob aus heiliger Göttlicher Schrift D. [Martin] Luthers und andern Büchern colligiret : [Hochzeitpredigt auf] Valentin , : ,,,,,,,,,,,1,02
994874820,L-1819-158242661,Aal,DBSM/F/Bö,Bö E IV 511,Bö E IV 511,1819,Materialien zur Gesetzgebung über die Preßfreiheit der Teutschen besonders zur Grundbestimmung auf dem Bundestag : , : ,,,,,,,,,,,1,02
994896549,L-1829-158267982,Aal,DBSM/F/Bö,Bö B III 209,Bö B III 209,1829,[Proben aus der Schriftschneiderei und Giesserei von F. Dresler und Rost-Fingerlin in Frankfurt a.M.] : , : ,,,,,,,,,,,1,02
994946422,L-1794-158341082,Aal,DBSM/F/Bö,Bö C IV 224,Bö C IV 224,1794,De @Druk-Kunst : Eene verhandeling ; Uitgesprooken in eene aanzienlyke maatschappy, : ,,,,,,,,[Mit hs. Widmung v. Gr. Koning],,,1,02
994978103,L-1772-158451945,Aal,DBSM/F/Bö,Bö B V 135/2°,Bö B V 135/2°,1772,L' @Art du relieur-doreur de livres : , : ,,,,,,,,,,,1,02
995011079,L-1538-15850626X,Aal,DBSM/F/Bö,Bö B III 131 a/4°,Bö B III 131 a/4°,1538,"Vnderweysuug [!Unterweisung] der Messung,|| mit dem Zirckel vnd richtscheyt,|| in Linien Ebnen vn[d] gantzen Corporen, durch Albrecht|| Dürer zusamen ", : ,,,,,,,,,,,1,02
99501230X,L-1535-158507789,Aal,DBSM/F/Bö,Bö B III 132/4°,Bö B III 132/4°,1535,"Albertvs|| Dvrervs Nv-||Rembergensis Pictor ...||, versus è Germanica lingua in Lati||nam, ... Quatuor his suaru[m]|| Institutionum Geometricarum libr", : ,,,,,,,,,,,1,02
995090548,L-1798-158758277,Afl,DBSM/F/Bö,Bö B III 1386,Bö B III 1386,1798,"Pflanzen-Belustigungen oder Anqeisung, wie man getrocknete Pflanzen auf eine leichte und geschwinde Art sauber abdrucken kann, für Kinder viell. auch ",1. : ,,,,,,,,Schenkg Kirchhoff,,,1,02
995091528,L-1783-158759478,Afl,DBSM/F/Bö,Bö G II 433,Bö G II 433,1783,Catalogue des livres de la biblioth`eque de feu M. [Louis César de La Baume-Le-Blanc] Duc de La Vallière,"Partie 1., T. 1. : Les @manuscrits, les premières éditions, les livres imprimés sur vélin & sur grand panier, les livres rares & précieux...etc. ..., ",", ",,,,,,,,,,1,02
995091722,L-1783-158759834,Afl,DBSM/F/Bö,Bö G II 433,Bö G II 433,1783,Catalogue des livres de la biblioth`eque de feu M. [Louis César de La Baume-Le-Blanc] Duc de La Vallière,"Partie 1., T. 2. : Les @manuscripts, les premières éditions, les livres imprimés sur vélin & sur grand panier, les livres rares & précieux...etc. ..., ",", ",,,,,,,,,,1,02
995091722,L-1783-158761049,Afl,DBSM/F/Bö,Bö G II 433 a,Bö G II 433 a,1783,Catalogue des livres de la biblioth`eque de feu M. [Louis César de La Baume-Le-Blanc] Duc de La Vallière,"Partie 1., T. 2. : Les @manuscripts, les premières éditions, les livres imprimés sur vélin & sur grand panier, les livres rares & précieux...etc. ..., ",", ",,,,,,,,,,1,03
995092354,L-1783-158760700,Afl,DBSM/F/Bö,Bö G II 433,Bö G II 433,1783,Catalogue des livres de la biblioth`eque de feu M. [Louis César de La Baume-Le-Blanc] Duc de La Vallière,"Partie 1., T. 3. : , ",", ",,,,,,,,,,1,02
995092354,L-1783-158760999,Afl,DBSM/F/Bö,Bö G II 433 a,Bö G II 433 a,1783,Catalogue des livres de la biblioth`eque de feu M. [Louis César de La Baume-Le-Blanc] Duc de La Vallière,"Partie 1., T. 3. : , ",", ",,,,,,,,,,1,03
995092842,L-1784-158761278,Afl,DBSM/F/Bö,Bö G II 433,Bö G II 433,1784,Catalogue des livres de la biblioth`eque de feu M. [Louis César de La Baume-Le-Blanc] Duc de La Vallière,"Partie 2., T. 1. : Un très-grande quantité de livres anciens & modernes, nationaux & étrangers, imprimés en différentes langues, ..., ",", ",,,,,,,,,,1,02
995093016,L-1784-158761456,Afl,DBSM/F/Bö,Bö G II 433,Bö G II 433,1784,Catalogue des livres de la biblioth`eque de feu M. [Louis César de La Baume-Le-Blanc] Duc de La Vallière,"Partie 2., T. 2. : Un très-grande quantité de livres anciens & modernes, nationaux & étrangers, imprimés en différentes langues, ..., ",", ",,,,,,,,,,1,02
995093016,L-1784-158761464,Afl,DBSM/F/Bö,Bö G II 433 a,Bö G II 433 a,1784,Catalogue des livres de la biblioth`eque de feu M. [Louis César de La Baume-Le-Blanc] Duc de La Vallière,"Partie 2., T. 2. : Un très-grande quantité de livres anciens & modernes, nationaux & étrangers, imprimés en différentes langues, ..., ",", ",,,,,,,,,,1,03
99509327X,L-1784-158761766,Afl,DBSM/F/Bö,Bö G II 433,Bö G II 433,1784,Catalogue des livres de la biblioth`eque de feu M. [Louis César de La Baume-Le-Blanc] Duc de La Vallière,"Partie 2., T. 3. : Un très-grande quantité de livres anciens & modernes, nationaux & étrangers, imprimés en différentes langues, ..., ",", ",,,,,,,,,,1,02
99509327X,L-1784-158761774,Afl,DBSM/F/Bö,Bö G II 433 a,Bö G II 433 a,1784,Catalogue des livres de la biblioth`eque de feu M. [Louis César de La Baume-Le-Blanc] Duc de La Vallière,"Partie 2., T. 3. : Un très-grande quantité de livres anciens & modernes, nationaux & étrangers, imprimés en différentes langues, ..., ",", ",,,,,,,,,,1,03
995093601,L-1784-158762061,Afl,DBSM/F/Bö,Bö G II 433,Bö G II 433,1784,Catalogue des livres de la biblioth`eque de feu M. [Louis César de La Baume-Le-Blanc] Duc de La Vallière,"Partie 2., T. 4. : Un très-grande quantité de livres anciens & modernes, nationaux & étrangers, imprimés en différentes langues, ..., ",", ",,,,,,,,,,1,02
995093733,L-1784-158762193,Afl,DBSM/F/Bö,Bö G II 433,Bö G II 433,1784,Catalogue des livres de la biblioth`eque de feu M. [Louis César de La Baume-Le-Blanc] Duc de La Vallière,"Partie 2., T. 5. : Un très-grande quantité de livres anciens & modernes, nationaux & étrangers, imprimés en différentes langues, ..., ",", ",,,,,,,,,,1,02
995093784,L-1784-15876224X,Afl,DBSM/F/Bö,Bö G II 433,Bö G II 433,1784,Catalogue des livres de la biblioth`eque de feu M. [Louis César de La Baume-Le-Blanc] Duc de La Vallière,"Partie 2., T. 6. : Un très-grande quantité de livres anciens & modernes, nationaux & étrangers, imprimés en différentes langues, ..., ",", ",,,,,,,,,,1,02
995118566,L-1719-158797752,Aal,DBSM/F/Bö,(Großformate),Bö B I 352/2,1719,Le @Trésor|| Des Novvelles|| Escritures de Finances|| et Italiennes bastardes|| A la Mode|| Auec les belles Instructions &|| Secrets dudit Art|| Dedié, : ,,,,,,,,,,,1,02
995186464,L-1814-158950879,Aal,DBSM/F/Bö,Bö E III 573,Bö E III 573,1814,"Die @deutschen Schriftsteller : was sie thaten, was sie für Unrecht leiden, und was ihnen für Lohn gebührt", : ,,,,1044992719,Qd,,,,,,1,02
995206686,L-1811-158972880,Aal,DBSM/F/Bö,Bö G II 7,Bö G II 7,1811,"Ueber öffentliche Bibliotheken, besonders deutsche Universitätsbibliotheken und Vorschläge zu einer zweckmässigen Einrichtung derselben : ", : ,,,,,,,,,,,1,02
995207089,L-1823-158973216,Aal,DBSM/F/Bö,Bö G II 9,Bö G II 9,1823,Bibliothekswissenschaft : , : ,,,,,,,,,,,1,02
995207372,L-1820-15897350X,Aal,DBSM/F/Bö,Bö G II 54,Bö G II 54,1820,"Die @Bildung des Bibliothekars : an Herrn Behringer, bestverdienten 4. Lehrer u. Mathematicus an d. Nicolaischule zu Leipzig, am Tage s. Promotionsjub", : ,,,,,,,,,,,1,02
995209227,L-1825-158975111,Aal,DBSM/F/Bö,Bö C IV 228,Bö C IV 228,1825,"Die @Buchdruckerkunst, ihre Geschichte : ", : ,,,,,,,,Mit hs. Eintraggn.,,,1,02
995209685,L-1821-158975510,Aal,DBSM/F/Bö,Bö G II 8,Bö G II 8,1821,"Thomas Frognall Dibdin, a bibliographical, antiquarian and picturesque tour in France and Germany ; [Besprechung] : ", : ,,,,,,,,,,,1,02
995210187,L-1820-158975979,Aal,DBSM/F/Bö,Bö F III 6,Bö F III 6,1820,"Ueber einige Mängel der neuern deutschen Bibliographie und über ihr Verhältniß zur französischen, nebst Anzeige von Jacq. Charl. Brunet Manuel du libr", : ,,,,,,,,,,,1,02
995210268,L-1823-158976053,Aal,DBSM/F/Bö,Bö C IV 226,Bö C IV 226,1823,Neue Prüfung der holländischen Ansprüche auf die Erfindung der Buchdruckerkunst : auf Veranl. d. haarlemer Jubelfeier, : ,,,,,,,,,,,1,02
99521039X,L-1825-158976215,Aal,DBSM/F/Bö,Bö C IV 225,Bö C IV 225,1825,Nieuw Onderzoek naar de aanspraak van Holland op de uitvinding der boekdrukkunst : , : ,,,,,,,,,,,1,02
995213259,L-1776-158991966,Aal,DBSM/F/Bö,Bö G I 49,Bö G I 49,1776,"Uebersicht der Oerter wo die bekanntesten griechischen Schriftsteller gelebt haben; und Grundlage zur Geschichte der Bibliotheken, wodurch jene in Han", : ,,,,,,,,,,,1,02
995215790,L-1715-158994914,Aal,DBSM/F/Bö,Bö G I 50,Bö G I 50,1715,Kurtze Nachricht von den öffentlichen Bibliothequen zu Qvedlinburg : , : ,,,,,,,,,,,1,02
995228612,L-1749-159008522,Aal,DBSM/F/Bö,Bö E IV 993/4°,Bö E IV 993/4°,1749,"Edict wegen der wieder hergestelleten Censur derer in königl. Landen heraus kommenden Bücher und Schrifften, wie auch wegen des Debits ärgerlicher Büc", : ,,,,,,,,,,,1,02
995230331,L-1825-159010292,Aal,DBSM/F/Bö,Bö E IV 1545/4°,Bö E IV 1545/4°,1825,"Editto D. Placido dell'Ordine di S. Benedetto della Congregazione Camaldolese ... : L'invenzione, il perfezionamento delle arti, ...", : ,,,,,,,,,,,1,02
