idn,akz,bbg,standort,signatur_g,signatur_a,jahr,titel,stuecktitel,f4243,f4256,f4241,f4105_9,f4105_g,ausleihcode,sig_komm,f4801_a,f4801_k,bibliothek,einrichtung,exemplar
1000903826,L-1798-171503104,Afl,DBSM/F/Bö,Bö C V 286,Bö C V 286,1798,Sammlung der Verordnungen der Reichsstadt Frankfurt,1. : Sicherheit d. Person u. d. Eigenthums,,,,,,,,,,,1,02
1000904024,L-1798-171503287,Afl,DBSM/F/Bö,Bö C V 286,Bö C V 286,1798,Sammlung der Verordnungen der Reichsstadt Frankfurt,2. : Richt. Gebrauch u. gehör. Verwaltg d. Eigenthums,,,,,,,,,,,1,02
1000904091,L-1798-171503392,Afl,DBSM/F/Bö,Bö C V 286,Bö C V 286,1798,Sammlung der Verordnungen der Reichsstadt Frankfurt,3. : Sitten u. Religion,,,,,,,,,,,1,02
1000904172,L-1798-171503473,Afl,DBSM/F/Bö,Bö C V 286,Bö C V 286,1798,Sammlung der Verordnungen der Reichsstadt Frankfurt,4. : Commerciengesetze,,,,,,,,,,,1,02
1000904261,L-1798-17150352X,Afl,DBSM/F/Bö,Bö C V 286,Bö C V 286,1798,Sammlung der Verordnungen der Reichsstadt Frankfurt,5. : Communication im Handel u. Wandel,,,,,,,,,,,1,02
1000904377,L-1799-171503619,Afl,DBSM/F/Bö,Bö C V 286,Bö C V 286,1799,Sammlung der Verordnungen der Reichsstadt Frankfurt,6. : Fürsorge bey d. häußl. Niederlassg u. bey d. Aufenthalte im Frankfurter Staat,,,,,,,,,,,1,02
1000904458,L-1799-171503724,Afl,DBSM/F/Bö,Bö C V 286,Bö C V 286,1799,Sammlung der Verordnungen der Reichsstadt Frankfurt,7. : Gesundheitspflege,,,,,,,,,,,1,02
1000904504,L-1799-171503864,Afl,DBSM/F/Bö,Bö C V 286,Bö C V 286,1799,Sammlung der Verordnungen der Reichsstadt Frankfurt,8. : Rechtspflege,,,,,,,,,,,1,02
100090461X,L-1799-171504054,Afl,DBSM/F/Bö,Bö C V 286,Bö C V 286,1799,Sammlung der Verordnungen der Reichsstadt Frankfurt,9. : Allg. Sicherheits-Anstalten u. Vollziehungsgesetze,,,,,,,,,,,1,02
1000904873,L-1818-171504461,Afl,DBSM/F/Bö,Bö C V 286,Bö C V 286,1818,Sammlung der Verordnungen der Reichsstadt Frankfurt,11. : Verordnungen v. 1800 bis zu Ende d. reichs - städt,,,,,,,,"[Enth. die auf d. Buchgewerbe, auf Buchdruckereien Buchbinder, Künstler, Papiermacher etc. bezügl. Verordnungen v. J. 1660 an]",,,1,02
1000931366,L-1797-171698053,Aal,DBSM/F/Bö,Bö B III 283,Bö B III 283,1797,"Saggi dei caratteri, fregi, e sgraffe della nuova fonderia di Giambattista Sassi tipografo : ", : ,,,,,,,,,,,1,02
1000942589,L-1644-171709489,Aal,DBSM/F/Bö,Bö B I 455,Bö B I 455,1640,Fiori di letere Cancellaresche Moderne : , : ,,,,,,,,,,,1,02
1000942821,L-1798-171709683,Aal,DBSM/F/Bö,Bö F III 109,Bö F III 109,1798,Edizioni del secolo 15. ignote ai maggiori bibliografi e fatte conoscere da Giacomo Sardini nella sua opera Jensoniana le quali si conservano in alcun, : ,,,,,,,,,,,1,02
1000954560,L-1745-171720865,Aal,DBSM/F/Bö,Bö C V 1793/2°,Bö C V 1793/2°,1745,"Historia literario-typographica Mediolanensis, in qua de studiis literariis antiquis et novis in hac metropoli institutis, de tempore inductae Mediola", : ,,,,,,,,,,,1,02
1000968634,L-1643-171782844,Aal,DBSM/F/Bö,Bö G I 149,Bö G I 149,1643,"Historia bibliothecae Reip. Noribergenses, duabus oratiunculis illustrata, quarum altera de ejus structoribus, altera de rarioribus quibusdam & scitu ", : ,,,,,,,,,,,1,02
100097054X,L-1818-171784847,Aal,DBSM/F/Boe,Bö E III 1284,Bö E III 1284,1818,An das deutsche Publikum : , : ,,,,,,,,,,,1,02
1000981096,L-1830-17179558X,Aal,DBSM/F/Bö,Bö C V 95,Bö C V 95,1830,Die @erste Verbreitung der Buchdruckerkunst im Herzogthum Nassau : , : ,,,,,,,,,,,1,02
1000986845,L-1774-171801466,Afl,DBSM/F/Bö,Bö G II 921,Bö G II 921,1774,Catalogus bibliothecae quam ... Augustin Martin Schadeloock ... collegit,"1, 1. : Libri theologici",,,,,,,,[Mit gest. herald. Exlibris],,,1,02
1000989372,L-1744-171803914,Aal,DBSM/F/Bö,Bö G I 31,Bö G I 31,1744,Epistolae : , : ,,,,,,,,,,,1,02
1001004779,L-1765-171824547,Afl,DBSM/F/Bö,Bö B II 215,Bö B II 215,1765,Jacob Christian Schäffers Versuche und Muster ohne alle Lumpen oder doch mit einem geringen Zusatze derselben Papier zu machen,1 : ,,,,,,,,Hist. Einbd.,,,1,02
1001004841,L-1765-17182461X,Afl,DBSM/F/Bö,Bö B II 215,Bö B II 215,1765,Jacob Christian Schäffers Versuche und Muster ohne alle Lumpen oder doch mit einem geringen Zusatze derselben Papier zu machen,2 : ,,,,,,,,Hist. Einbd.,,,1,02
1001006224,L-1746-171825985,Aal,DBSM/F/Bö,Bö G II 419,Bö G II 419,1746,Catalogus bibliothecae Scharffianae [Gottfried Balthasar Scharff] universe junctimque aequo pretio vendendae : , : ,,,,,,,,,,,1,02
1001006984,L-1765-171826647,Afl,DBSM/F/Bö,Bö B II 215 a,Bö B II 215 a,1772,Jacob Christian Schäffers Versuche und Muster ohne alle Lumpen oder doch mit einem geringen Zusatze derselben Papier zu machen,1. : ,,,,,,,,,,,1,02
1001007123,L-1765-171826817,Afl,DBSM/F/Bö,Bö B II 215 a,Bö B II 215 a,1772,Jacob Christian Schäffers Versuche und Muster ohne alle Lumpen oder doch mit einem geringen Zusatze derselben Papier zu machen,2. : ,,,,,,,,,,,1,02
1001008898,L-1765-171828380,Afl,DBSM/F/Bö,Bö B II 215,Bö B II 215,1765,"Jacob Christian Schäffers Neue Versuche und Muster, das Pflanzenreich zum Papiermachen und anderen Sachen wirthschaftsnützlich zu gebrauchen",1 : ,,,,,,,,,,,1,02
1001008995,L-1765-171828496,Afl,DBSM/F/Bö,Bö B II 215,Bö B II 215,1765,"Jacob Christian Schäffers Neue Versuche und Muster, das Pflanzenreich zum Papiermachen und anderen Sachen wirthschaftsnützlich zu gebrauchen",2 : ,,,,,,,,,,,1,02
1001009118,L-1765-171828593,Afl,DBSM/F/Bö,Bö B II 215,Bö B II 215,1765,"Jacob Christian Schäffers Neue Versuche und Muster, das Pflanzenreich zum Papiermachen und anderen Sachen wirthschaftsnützlich zu gebrauchen",3 : ,,,,,,,,,,,1,02
1001009495,L-1765-171828933,Afl,DBSM/F/Bö,Bö B II 215 a,Bö B II 215 a,1772,"Jacob Christian Schäffers Neue Versuche und Muster, das Pflanzenreich zum Papiermachen und andern Sachen wirthschaftsnützlich zu gebrauchen",1. : ,,,,,,,,,,,1,02
1001009657,L-1765-171829085,Afl,DBSM/F/Bö,Bö B II 215 a,Bö B II 215 a,1772,"Jacob Christian Schäffers Neue Versuche und Muster, das Pflanzenreich zum Papiermachen und andern Sachen wirthschaftsnützlich zu gebrauchen",2. : ,,,,,,,,,,,1,02
1001009789,L-1765-171829204,Afl,DBSM/F/Bö,Bö B II 215 a,Bö B II 215 a,1765,"Jacob Christian Schäffers Neue Versuche und Muster, das Pflanzenreich zum Papiermachen und andern Sachen wirthschaftsnützlich zu gebrauchen",3. : ,,,,,,,,,,,1,02
1001014391,L-1771-171833686,Aal,DBSM/F/Bö,Bö B II 215,Bö B II 215,1771,Jacob Christian Schäffers wiederholte Versuche auf ordentlichen Papiermühlen aus allerhand Pflanzen und Holzarten Papier zu machen : Nebst 10 Mustern , : ,,,,,,,,,,,1,02
1001014820,L-1771-17183402X,AFl,DBSM/F/Bö,Bö B II 215 a,Bö B II 215 a,1772,Jacob Christian Schäffers wiederholte Versuche auf ordentlichen Papiermühlen aus allerhand Pflanzen und Holzarten Papier zu machen : Nebst 10 Mustern , : ,,,,,,,,,,,1,02
1001015924,L-1827-171835034,Aal,DBSM/F/Bö,Bö H 248/4°,Bö H 248/4°,1827,"Kirchhoff & Wigand, Antiquariats-Buchhandlung, Leipzig, Gedruckte Geschäftsrundschreiben v. 25.4.1856 - 1.3.1869 : ", : ,,,,,,,,,,,1,02
1001017048,L-1753-171836227,Afl,DBSM/F/Bö,Bö C IV 441,Bö C IV 441,1753,Pinacotheca libraria s[ive] heraldica bibliopolarum antiquo-recentiorum,[T. 2] : ,,,,,,,,,,,1,02
1001022505,L-1796-171841859,Aal,DBSM/F/Bö,Bö E IV 120,Bö E IV 120,1796,Kurzgefaßte Geschichte der kais[erlich-]kön[iglichen] Bücherzensur und Revision im Königreiche Böhmen : , : ,,,,,,,,,,,1,02
100102768X,L-1788-17184677X,Afl,DBSM/F/Bö,Bö G II 310,Bö G II 310,1788,Catalogus Bibliothecae Arletianae [Johanni Caspari Arletii,1. : [Versteig.:] 1. Jan. 1788,,,,,,,,[Mit hs. Preis-Ergänzgn],,,1,02
1001027787,L-1788-171846877,Afl,DBSM/F/Bö,Bö G II 310,Bö G II 310,1788,Catalogus Bibliothecae Arletianae [Johanni Caspari Arletii,2. : [Versteig.:] 1. Oct. 1788,,,,,,,,,,,1,02
1001028325,L-1794-171847482,Afl,DBSM/F/Bö,Bö F II 203,Bö F II 203,1794,Nachrichten von dem Merkwürdigkeiten der Rehdigerischen Bibliothek zu Breslau,Stück 1 : ,,,,,,,,,,,1,02
1001034171,L-1741-171870832,Afl,DBSM/F/Bö,Bö A II 273/2°,Bö A II 273/2°,1741,"Allgemeine Schatz-Kammer der Kauffmannschafft oder Vollständiges Lexicon aller Handlungen und Gewerbe, so wohl in Deutschland als auswärtigen Konigrei",1. : A - C,,,,,,,,,,,1,02
100103421X,L-1741-171870883,Afl,DBSM/F/Bö,Bö A II 273/2°,Bö A II 273/2°,1741,"Allgemeine Schatz-Kammer der Kauffmannschafft oder Vollständiges Lexicon aller Handlungen und Gewerbe, so wohl in Deutschland als auswärtigen Konigrei",2. : D - L,,,,,,,,,,,1,02
1001034236,L-1742-171870913,Afl,DBSM/F/Bö,Bö A II 273/2°,Bö A II 273/2°,1742,"Allgemeine Schatz-Kammer der Kauffmannschafft oder Vollständiges Lexicon aller Handlungen und Gewerbe, so wohl in Deutschland als auswärtigen Konigrei",3. : M - R,,,,,,,,,,,1,02
1001034252,L-1742-17187093X,Afl,DBSM/F/Bö,Bö A II 273/2°,Bö A II 273/2°,1742,"Allgemeine Schatz-Kammer der Kauffmannschafft oder Vollständiges Lexicon aller Handlungen und Gewerbe, so wohl in Deutschland als auswärtigen Konigrei",4. : S - Z,,,,,,,,,,,1,02
1001034309,L-1743-171870999,Afl,DBSM/F/Bö,Bö A II 273/2°,Bö A II 273/2°,1743,"Allgemeine Schatz-Kammer der Kauffmannschafft oder Vollständiges Lexicon aller Handlungen und Gewerbe, so wohl in Deutschland als auswärtigen Konigrei",5 : ,,,,,,,,,,,1,02
1001036395,L-1781-171872851,Afl,DBSM/F/Bö,Bö E I 52,Bö E I 52,1781,"Joh[ann] Gottfried Schaumburgs Einleitung zum sächsischen Rechte, mit Anführung derer neuern zeithero und bis jetzo erlassenen allerhöchsten und höchs",T. 1 - 3 : ,,,,,,,,,,,1,02
1001039432,L-1788-171875575,Aal,DBSM/F/Bö,Bö G II 68,Bö G II 68,1788,Anleitung für Bibliothekare und Archivare : , : ,,,,,,,,,,,1,02
100104147X,L-1760-171877438,Aal,DBSM/F/Bö,Bö C IV 133,Bö C IV 133,1760,De antiquissima latinor[um] bibliorum editione ceu primo artis typographicae foetu et rariorum librorum phoenice Joannis Georgii Schelhornii diatribe , : ,,,,,,,,,,,1,02
1001042301,L-1795-171878272,Aal,DBSM/F/Bö,Bö B III 1003,Bö B III 1003,1795,Kurze Abhandlung über die Aetzkunst : , : ,,,,,,,,Schenkg Kirchhoff,,,1,02
1001053974,L-1823-171889800,Aal,DBSM/F/Bö,Bö C IV 214,Bö C IV 214,1823,"Vier brieven, gewisseld tusschen Mr. Jacobus Scheltema en Jacobus Koning, over de laatste tegenspraak van regt van Haarlem op de uitvinding der drukku", : ,,,,,,,,,,,1,02
1001055233,L-1817-17189085X,Afl,DBSM/F/Bö,Bö C IV 241,Bö C IV 241,1817,Geschied- en letterkundig Mengelwerk van Jakob Scheltema,"2. : Berigt en beoordeeling van de verhandeling van Jacobus Koning, over de uitvinding, verbetering en volmaking, der boekdrukkunst",,,,,,,,Schenkg Kirchhoff,,,1,02
100106609X,L-1752-172065127,Aal,DBSM/F/Bö,Bö C IV 134,Bö C IV 134,1752,Dissertation sur lʹorigine de lʹimprimerie : , : ,,,,,,,,,,,1,02
1001083938,L-1730-172082110,Aal,DBSM/F/Bö,Bö B I 149,Bö B I 149,1730,Alphabeti ex diplomatibus et codicibus Thuricensibus (!) specimen : , : ,,,,,,,,,,,1,02
1001119258,L-1740-172926408,Aal,DBSM/F/Bö,Bö C IV 300,Bö C IV 300,1740,"Johannes Schilters Beweiß, daß Straßburg sich gewiß und allein rühmen könne wegen der Erfindung der Buchdruckerey, bey jetzigem 3. Buchdrucker-Jubilae", : ,,,,,,,,,,,1,02
100113334X,L-1764-172966167,Aal,DBSM/F/Bö,Bö C V 753,Bö C V 753,1764,Commentatio de primis Vindabonae typographis : cum variis ad rem litterariam adnotationibus, : ,,,,,,,,,,,1,02
1001136438,L-1821-17296976X,Aal,DBSM/F/Bö,Bö B III 287,Bö B III 287,1821,"Specimen novae typographiae indicae, iussu Ministrorum Regis Borussiae, Principis ab Hardenberg et Dynastae ab Altenstein, rerum ecclesiasticarum et e", : ,,,,,,,,,,,1,02
1001137604,L-1714-172970814,Aal,DBSM/F/Bö,Bö G II 229,Bö G II 229,1714,Christiani Schlegelii de Codice Willigisano Epistola : , : ,,,,,,,,,,,1,02
1001139321,L-1787-172972299,Aal,DBSM/F/Bö,Bö D VII 884,Bö D VII 884,1787,"Verzeichnis der Bücher, welche Herr Professor [Johann Heinrich] Schlegel in Copenhagen auf eigene Kosten gedrukt und verlegt und Leipziger Ostermesse ", : ,,,,,,,,,,,1,02
100114872X,L-1742-17298159X,Aal,DBSM/F/Bö,Bö D VI 141,Bö D VI 141,1742,"Catalogus aliquot librorum, qui propriis sumtibus prodierunt ut et in copia habendi sunt apud Georgium Marcum Knoch, bibliopolam Dantiscanum : ", : ,,,,,,,,,,,1,02
1001163494,L-1794-173756395,Aal,DBSM/F/Bö,Bö C VII 327,Bö C VII 327,1794,"Joh[ann] Gottlob Immanuel Breitkopf, Buchdrucker und Buchhändler in Leipzig : Den 28. Jan.", : ,,,,,,,,Stiftg Hermann,,,1,02
1001164083,L-1817-173756905,Aal,DBSM/F/Bö,Bö B III 1055,Bö B III 1055,1817,"Briefe über die Erfindung des Steindruckes : 1. Brief. An d. Hrn. Kreisrath Lipowsky. München, d. 18. Nov. 1816 ; [2. Brief. An d. Hrn. Geh. R. Franz ", : ,,,,,,,,,,,1,02
100116475X,L-1793-173757545,Aal,DBSM/F/Bö,Bö C VII 327,Bö C VII 327,1793,Maria Luise Weidmann : [Nachricht über die von ihr hinterlassenen Legate], : ,,,,,,,,Stiftg Hermann,,,1,02
1001179846,L-1795-173772269,Afl,DBSM/F/Bö,Bö E IV 463,Bö E IV 463,1795,Des @Grafen Woldemar Friedrich von Schmettow kleine Schriften,T. 1 : ,,,,,,,,,,,1,02
1001183177,L-1741-173775772,Aal,DBSM/F/Bö,Bö C V 279,Bö C V 279,1741,Jubel-Postulats-Prologus : , : ,,,,,,,,,,,1,02
1001188810,L-1825-173781934,Aal,DBSM/F/Bö,Bö E IV 566,Bö E IV 566,1825,Das @teutsche Staats-Recht : ein Handbuch zum Gebrauche academischer Vorlesungen, : ,,,,,,,,,,,1,02
1001189876,L-1684-173782981,Aal,DBSM/F/Bö,Bö B III 528,Bö B III 528,1684,"Neu=vorgestelltes auf der Löblichen Kunst Buchdruckerey gebräuchliches Format-Buch, worinnen allerhand Nachrichtungs-Figureb, die Columnen recht auszu", : ,,,,,,,,Schenkg Kirchhoff,,,1,02
1001198158,L-1781-173789366,Aal,DBSM/F/Bö,Bö F III 477,Bö F III 477,1781,Christian Heinrich Schmids Anweisung der vornehmsten Bücher in allen Theilen der Dichtkunst : , : ,,,,,,,,,,,1,02
1001204476,L-1641-173816444,Aal,DBSM/F/Bö,Bö C V 697,Bö C V 697,1641,"Drey christliche Danck-Predigten, wegen dero im Jahr 1440 ... in Straßburg erfundenen ... Buchtrucker-Kunst ... zu Straßburg Anno 1640, d. 18. 25, Aug", : ,,,,,,,,,,,1,02
1001205030,L-1708-173816932,Aal,DBSM/F/Bö,Bö C V 698,Bö C V 698,1708,"Gott zu Lob : Drey christliche Danck-Predigten, wegen dero im Jahr 1440 ... in Straßburg erfundenen ... Buchtrucker-Kunst ... zu Straßburg Anno 1640, ", : ,,,,,,,,,,,1,02
1001205464,L-1740-173817467,Aal,DBSM/F/Bö,Bö C V 699,Bö C V 699,1740,"Gott zu Lob : Drey christliche Danck-Predigten, wegen dero im Jahr 1440 ... in Straßburg erfundenen ... Buchtrucker-Kunst ... zu Straßburg Anno 1640, ", : ,,,,,,,,,,,1,02
1001212355,L-1634-173824943,Aal,DBSM/F/Bö,(DA 04.02.03.0815),Bö B III 545,1634,"Des @Heiligen Jobs Bleyern Schreib-Täfflein : zu Lob der edlen Drucker-Kunst, erkläret [... wowen vnd wer solche werthe Kunst erfunden]", : ,,,,,,,,,k,,1,02
1001218620,L-1696-173831400,Aal,DBSM/F/Bö,Bö C VII 3041/4°,Bö C VII 3041/4°,1696,Catalogus scriptorum beati domini d. Sebastiani Schmidii typis editorum : , : ,,,,,,,,,,,1,02
1001236548,L-1796-173894054,Afl,DBSM/F/Bö,Bö C V 501,Bö C V 501,1796,Conversations-Lexikon oder kurzgefaßtes Handwörterbuch für die in d. gesellsch. Unterhaltg aus d. Wiss. u. Künsten vorkomm. Gegenstände mit beständ. R,1 : ,,,,,,,,,,,1,02
1001236599,L-1797-173894100,Afl,DBSM/F/Bö,Bö C V 501,Bö C V 501,1797,Conversations-Lexikon oder kurzgefaßtes Handwörterbuch für die in d. gesellsch. Unterhaltg aus d. Wiss. u. Künsten vorkomm. Gegenstände mit beständ. R,2 : ,,,,,,,,,,,1,02
1001236629,L-1798-173894143,Afl,DBSM/F/Bö,Bö C V 501,Bö C V 501,1798,Conversations-Lexikon oder kurzgefaßtes Handwörterbuch für die in d. gesellsch. Unterhaltg aus d. Wiss. u. Künsten vorkomm. Gegenstände mit beständ. R,3 : ,,,,,,,,,,,1,02
1001236874,L-1811-173894437,Afl,DBSM/F/Bö,Bö C V 501,Bö C V 501,1811,Conversations-Lexikon oder kurzgefaßtes Handwörterbuch für die in d. gesellsch. Unterhaltg aus d. Wiss. u. Künsten vorkomm. Gegenstände mit beständ. R,Nachtr. 2 : ,,,,,,,,,,,1,02
1001255461,L-1799-173913504,Aal,DBSM/F/Bö,Bö C V 129,Bö C V 129,1799,Slavischer Bücherdruck in Würtemberg in 16. Jahrhundert : , : ,,,,,,,,,,,1,03
1001261534,L-1814-173920144,Aal,DBSM/F/Bö,Bö C V 593,Bö C V 593,1814,"Anzeige einiger noch unbekannter alter Druckwerke, welche in der jetzigen Königsstadt München erschienen sind : ein Beytrag z. älteren Buchdruckergesc", : ,,,,,,,,Schenkg Kirchhoff,,,1,02
1001277295,L-1760-173998267,Aal,DBSM/F/Bö,Bö C IV 138,Bö C IV 138,1760,Jo[annis] Danielis Schoepflini Vindiciae typographicae : , : ,,,,,,,,[m. hs. Zus.],,,1,02
1001278518,L-1740-174014430,Aal,DBSM/F/Bö,Bö C V 242,Bö C V 242,1740,Historie derer Dreßdnischen Buchdrucker : , : ,,,,1044992719,Qd,,,Dieser Ausg. ist kein weiteres Werk angebunden; Schenkg Kirchhoff,,,1,04
100127895X,L-1722-174000065,Aal,DBSM/F/Bö,Bö C I 4,Bö C I 4,1722,"Historie derer Buchhändler, wie solche in Alten und Mitlern Zeiten gewesen : ", : ,,,,1044992719,Qd,,,,,,1,02
1001280369,L-1710-174004702,Aal,DBSM/F/Bö,Bö C I 27,Bö C I 27,1710,"De librariis et bibliopolis antiquorum disputabunt d. 19. Martii, MDCCX. h. 1. q. c. : ", : ,,,,,,,,Diese Ausgabe ist an kein anderes Werk angebunden,,,1,03
1001305582,L-1732-174113757,Aal,DBSM/F/Bö,Bö D III 13,Bö D III 13,1732,"Schreiben eines Buchhändlers aus Europa an einen anderen berühmten Buchhändler in Teutschland, die kürtzlich heraus gekommene Charteque ʺCharlatanerie", : ,,,,,,,,[vermutlich in Leipzig erschien. wie Textstellen andeuten],,,1,02
1001306082,L-1679-174114281,Aal,DBSM/F/Bö,Bö B III 144,Bö B III 144,1679,Der @Curiose Schreiber : Von allerley künstlichen und erdencklichen Arthen zu schreiben/ Itzt Mit vielen andern Raritäten/ auch Figuren die Proportion, : ,,,,,,,,"Vorbes. Eintrag: E. Jacobsen, kgl. Hofbeamter, Kopenhagen 14.3.1813",,,1,02
1001306465,L-1712-174114672,Aal,DBSM/F/Bö,Bö B III 145,Bö B III 145,1712,"Der @Curiöse Schreiber : von allerley künstlichen und erdencklichen Arthen zu schreiben ; Itzt mit vielen andern Raritäten, ... vermehret ; [Wie auch ", : ,,,,,,,,,,,1,02
1001314530,L-1708-174156588,Aal,DBSM/F/Bö,Bö B I 298,Bö B I 298,1708,"Der @wohl=erfahrne In allerhand ungemein-Curieusen Schreib-Arten auch sowol ergötzlichen als Sinn-reichen Gemüths-Übungen Anweisende Schreib Künstler,", : ,,,,,,,,,,,1,02
1001315340,L-9999-174157363,Aal,DBSM/F/Bö,Bö B I 461,Bö B I 461,1600,[Kalligraphische Schreibvorlagen : Niederlande 17. Jahrhundert], : ,,,,,,,,,,,1,02
1001317459,L-1810-174159412,Afl,DBSM/F/Bö,Bö G II 71,Bö G II 71,1810,Versuch eines vollständigen Lehrbuchs der Bibliothek-Wissenschaft oder Anleitung zur vollkommenen Geschäftsführung eines Bibliothekars in wissenschaft,3 : ,,,,,,,,,,,1,02
1001348133,L-1778-17419904X,Aal,DBSM/F/Bö,Bö E IV 95,Bö E IV 95,1778,De publica rei librariae cura imprimis Lipsiensi : , : ,,,,,,,,,,,1,02
1001348338,L-1665-174199260,Aal,DBSM/F/Bö,Bö D VII 885,Bö D VII 885,1665,Catalogus librorum à Gasparo Schotto Societatis Jesu hactenus editorum : , : ,,,,,,,,,,,1,02
1001356268,L-1665-174206887,Aal,DBSM/F/Bö,Bö B I 551,Bö B I 551,1665,"Gasparis Schotti Schola stenographica, in classes 8 distributa, quibus, praeter alia multa, ... explicantur artificia nova, queis quilibet, scribendo ", : ,,,,,,,,Im Obj. war früher noch eingebunden: Joh. Trithemii Steganographia u. V. J. Plempii de togatorum valetudine tuenda,,,1,02
1001357744,L-1687-174208421,Aal,DBSM/F/Bö,Bö B I 148,Bö B I 148,1687,"Gasparis Schotti Technica curiosa, sive mirabilia artis, libris 12 comprehensa : quibus varia experimenta, variaque technasmata pnevmatica, hydraulica", : ,,,,,,,,[Defekt! S. 921 - 928 durch leere Blätter ersetzt],,,1,02
1001376757,L-1640-174266782,Aal,DBSM/F/Bö,Bö C IV 301,Bö C IV 301,1640,Bericht von Erfindung der Buch Truckerey in Straßburg : , : ,,,,1044992719,Qd,,,,,,1,02
1001386450,L-1824-174276818,Aal,DBSM/F/Bö,Bö C VII 2798,Bö C VII 2798,1824,Gert's van der Schüren Chronik von Cleve und Mark : , : ,,,,,,,,"Mit hs. Widmg d. Hrsg. für Herrn Archivar Lacomblet, Düsseldorf; Einziges Ex. auf rosa Papier mit Goldschn.",,,1,02
1001386655,L-1517-174277016,Aal,DBSM/F/Bö,Bö H 8,Bö H 8,1517,"Brief an Erasmus von Rotterdam, 1517 : ", : ,,,,,,,,,,,1,02
1001397525,L-1697-174288565,Aal,DBSM/F/Bö,Bö C IV 302,Bö C IV 302,1697,De Typographia : , : ,,,,,,,,,,,1,02
1001404130,L-1799-174295502,Aal,DBSM/F/Bö,Bö F III 19 a,Bö F III 19 a,1799,Neue Handbibliothek für Bücherfreunde und junge Studirende aus allen Theilen der Litteratur nach Classen geordnet nebst Preisen : , : ,,,,,,,,,,,1,02
1001412257,L-1712-174321198,Aal,DBSM/F/Bö,Bö H 153,Bö H 153,1712,"[Schreibbuch : Handgeschriebene Vorlagen von Kanzleischriften, Initialen und ein- und mehrfarbigen Federzeichnungen]", : ,,,,,,,,,,,1,02
1001412850,L-1821-174321821,Aal,DBSM/F/Bö,Bö E IV 569,Bö E IV 569,1821,Deutschlands Preßgesetz seinem Wesen und seinem Folgen nach betrachtet : , : ,,,,,,,,Schenkg Kirchhoff,,,1,02
1001422236,L-1828-174331541,Aal,DBSM/F/Bö,Bö H 86,Bö H 86,1828,Convolut von Notizen und Excerpten über den deutsch-[österreichisch]en und russischen Buchhandel : , : ,,,,,,,,,,,1,02
1001439511,L-1786-174349351,Aal,DBSM/F/Bö,Bö C VII 2828/4°,Bö C VII 2828/4°,1786,"Chöre und Gesänge zur Athalia, [Trauerspiel mit Melodien und Chören in 5 Akten] von [Jean] Racine : ", : ,,,,,,,,,,,1,02
1001443667,L-1778-174428839,Aal,DBSM/F/Bö,Bö C V 153,Bö C V 153,1778,Libri typis elegantissimis typographicis Velserianis ad insigne pinus ab anno 1594 usque ad annum 1614 impressi : , : ,,,,,,,,,,,1,02
1001445759,L-1740-174446101,Aal,DBSM/F/Bö,Bö C IV 143,Bö C IV 143,1740,Primaria quaedam Documenta de origine typographiae quorum illustratorum partem 1 : , : ,,,,,,,,Geschenk Kirchhoff,,,1,02
1001445791,L-1725-174446144,Aal,DBSM/F/Bö,Bö C I 28,Bö C I 28,1725,Exercitatio de varia supellectile rei librariae veterum : , : ,,,,,,,,Schenkg Kirchhoff,,,1,02
1001445813,L-1727-174446179,Aal,DBSM/F/Bö,Bö F III 60,Bö F III 60,1727,"Index quorundam librorum saeculo XV impressorum, quos possidet Altorfii Christianus Gotlib Schwarzius, p.p. Concinnatus a J.C.H. et J.P.R. : ", : ,,,,,,,,,,,1,02
1001445856,L-1793-174446217,Aal,DBSM/F/Bö,Bö C IV 144,Bö C IV 144,1793,Christiani Gottlieb Schwarz Opuscula quaedam academica varii argumenti : cum [4] tab. aeri incisis, : ,,,,,,,,,,,1,02
1001445856,L-1793-174446225,Aal,DBSM/F/Bö,Bö C IV 143,Bö C IV 143,1793,Christiani Gottlieb Schwarz Opuscula quaedam academica varii argumenti : cum [4] tab. aeri incisis, : ,,,,,,,,,,,1,03
100144597X,L-1740-17444639X,Afl,DBSM/F/Bö,Bö B II 79,Bö B II 79,1740,De origine typographiae,P. 3. : / [Resp.:] Gustav Philipp Negelein,,,,,,,,Dieser Ausg. ist kein weiteres Werk angebunden,,,1,03
1001446194,L-1821-174446586,Aal,DBSM/F/Bö,Bö F III 100,Bö F III 100,1821,"Nachricht von einer verkäuflichen Sammlung von 12020, theils noch im 15. Jahrhunderte theils bis 1550 gedruckten Büchern, ... : [betr.:] Georg Christo", : ,,,,,,,,,,,1,02
1001447174,L-1830-174447604,Afl,DBSM/F/Bö,Bö F III 443,Bö F III 443,1830,Handbuch der classischen Bibliographie,1. : Griechische Schriftsteller,,,,,,,,,,,1,02
1001466977,L-1785-174948239,Afl,DBSM/F/Bö,Bö G II 421,Bö G II 421,1785,"Catalogus bibliothecae selectae duabus partibus consignatae quam ex omni eruditionis genere ... collegit atque adornavit ... Ioann Ioachim Schwabe, ph",[1.] : / mit Vorw. von J. G. I. Breitkopf,,,,,,,,Mit hs. beigef. Preisen,,,1,02
1001467078,L-1785-174948360,Afl,DBSM/F/Bö,Bö G II 421,Bö G II 421,1785,"Catalogus bibliothecae selectae duabus partibus consignatae quam ex omni eruditionis genere ... collegit atque adornavit ... Ioann Ioachim Schwabe, ph",2 : ,,,,,,,,Mit hs. beigef. Preisen,,,1,02
1001467310,L-1775-174948697,Aal,DBSM/F/Bö,Bö B III 764,Bö B III 764,1775,Reden bey der Aufnahme neuer Mitglieder in die Buchdrucker-Gesellschaft zu Leipzig : , : ,,,,,,,,,,,1,02
1001469917,L-1788-174952031,Aal,DBSM/F/Bö,Bö B II 37,Bö B II 37,1788,"Chartam lineam antiquissimam, omnia hactenus producta specimina aetate sua superantem ex cimeliis Bibliothecae Augustae Vindobonensis omnium Europae e", : ,,,,,,,,,,,1,02
1001471156,L-1756-17495347X,Aal,DBSM/F/Bö,Bö B I 462/2°,Bö B I 462/2°,1756,"Joannis Georgii|| Schwandneri|| Austriaci Stadelkirchensis|| Dissertatio|| Epistolaris|| De|| Calligraphiae|| Nomenclatione,|| Cultu,|| Praestantia,||", : ,,,,,,,,,,,1,02
1001476131,L-1733-174958870,Aal,DBSM/F/Bö,Bö B I 186,Bö B I 186,1733,Disputatio de ornamentis codicum veterum : , : ,,,,,,,,,,,1,02
1001482344,L-1756-17496871X,Aal,DBSM/F/Bö,Bö B III 914,Bö B III 914,1756,"Dello Scrivere, della stampa, e degli scrittori : canti tre dedicati all'illustriss. ed. Eccellentiss. Sig. Flaminio Corner Senator Veneto", : ,,,,,,,,[In zeitgenöss. Einbd.],,,1,02
1001482514,L-1628-174968981,Aal,DBSM/F/Bö,Bö C IV 207,Bö C IV 207,1628,"Petri Scriverii Laure-Crans voor Laurens Coster van Haerlem, eerste vinder vande boeckdruckery : ", : ,,,,,,,,Taf. fehlt,,,1,02
1001482514,L-1628-174968817,Aal,DBSM/F/Bö,Bö C IV 271,Bö C IV 271,1628,"Petri Scriverii Laure-Crans voor Laurens Coster van Haerlem, eerste vinder vande boeckdruckery : ", : ,,,,,,,,,,,1,03
1001482646,L-1770-174969198,Aal,DBSM/F/Bö,Bö B III 1026,Bö B III 1026,1770,"Sculptura historico-technica : or, the history and art of engraving", : ,,,,,,,,,,,1,02
1001487680,L-1705-174985053,Aal,DBSM/F/Bö,Bö B I 474/2°,Bö B I 474/2°,1705,"The @Penman's Magazine:|| Or, A|| New Copy-Book,|| Of the English, French and Italian|| Hands,|| After the Best Mode; Adorn'd with about an Hundred Ne", : ,,,,,,,,In zeitgen. Buntpapierumschl.,,,1,02
1001488636,L-1787-174985770,Afl,DBSM/F/Bö,Bö F III 111,Bö F III 111,1787,Bibliothecae Academicae Ingolstadiensis Incunabula typographica seu libri ante annum 1500 [4: ... impressi mille septingenti et amplius] impressi circ,1 : ,,,,,,,,,,,1,02
