idn,akz,bbg,standort,signatur_g,signatur_a,jahr,titel,stuecktitel,f4243,f4256,f4241,f4105_9,f4105_g,ausleihcode,sig_komm,f4801_a,f4801_k,bibliothek,einrichtung,exemplar
997858362,L-1583-165119969,Aal,DBSM/F/Bö,Bö B III 127,Bö B III 127,1583,"[Keuren] Kevren|| der Stadt Leyden des|| Graefschaps van|| Holland : Gedruc[k]t ten bevele van die vande|| Gerechte der voorschreven|| Stede, int Jaer", : ,,,,,,,,,,,1,02
997859946,L-1706-16512315X,Aal,DBSM/F/Bö,Bö C VII 2675/4°,Bö C VII 2675/4°,1706,Die @wohlgegründete Freude der kayserl. freyen und des Heil. Röm. Reiches-Stadt Mühlhausen bey der abermahligen Regierung erfreulichsten Übernehmung d, : ,,,,,,,,,,,1,02
997871067,L-1716-165137223,Aal,DBSM/F/Bö,Bö C VII 2676/4°,Bö C VII 2676/4°,1716,"Zu der nunmehr erlangten Ehre Herrn Joachim Friedrich Kienitzens von Gransäe aus der Mittelmarck, der löbl. Buchdruckerey-Kunst Befliessenen, welche i", : ,,,,,,,,,,,1,02
997883103,L-1827-165161604,Aal,DBSM/F/Bö,Bö H 248/4°,Bö H 248/4°,1827,Urkunden und Aktenstücke betreffend Herrn Dr. Albrecht Kirchhoff und die Firma Kirchhoff & Wigand zu Leipzig : 1827 - 1885, : ,,,,,,,,,,,1,02
997904852,L-1666-165267577,Aal,DBSM/F/Bö,Bö B II 7,Bö B II 7,1666,De Papyro veterum : , : ,,,,,,,,,,,1,02
997904968,L-1818-165267739,Afl,DBSM/F/Bö,Bö C V 277,Bö C V 277,1818,"Ansichten von Frankfurt am Main, der umliegenden Gegend und den benachbarten Heilquellen",1 : ,,,,,,,,Ausgabe ohne die Kupf.,,,1,02
997904984,L-1818-165267755,Afl,DBSM/F/Bö,Bö C V 277,Bö C V 277,1818,"Ansichten von Frankfurt am Main, der umliegenden Gegend und den benachbarten Heilquellen",2 : ,,,,,,,,Ausgabe ohne die Kupf.,,,1,02
997905123,L-1810-165267917,Afl,DBSM/F/Bö,Bö C V 278,Bö C V 278,1810,Geschichte der Stadt Frankfurt am Main,2 : ,,,,,,,,,,,1,02
997907827,L-1793-165270853,Aal,DBSM/F/Bö,Bö B III 604,Bö B III 604,1793,"Anweisung in der Buchdruckerkunst, so viel davon das Drucken betrifft : zum Unterr. f. Drucker u. ihre Lehrlinge ; mit [5] Kupfern u. 4 Holzschn.", : ,,,,,,,,,,,1,02
997908416,L-1799-165271310,Aal,DBSM/F/Bö,Bö B III 551,Bö B III 551,1799,"Gebrauch der Zeichen, welche in der Buchdrukkereien zum Korrigiren gewöhlich sind : nebst ein. Abdr. d. gewöhnlichsten Schrift-Arten u. einigen Tafeln", : ,,,,,,,,Schenkg Kirchhoff,,,1,02
997933755,L-1732-165312076,Aal,DBSM/F/Bö,Bö B III 498,Bö B III 498,1732,"Gottfried Kleiners Garten-Lust im Winter, angestellt durch kurtze und christliche Betrachtung unterschiedener Garten-Sprüche heiliger Schrifft; ... de", : ,,,,,,,,,,,1,02
997933917,L-1742-165312327,Aal,DBSM/F/Bö,Bö C V 742,Bö C V 742,1742,Gott-geheiligte evangelisch-lutherische Buchdrucker-Jubel-Freude ... wegen der ... 1440 ... erfundenen ... Buchdruckerkunst an ihrem 3. Jubel-Fest ..., : ,,,,,,,,Schenkg Kirchhoff. - Zeitgenoss. Ppbd m. goldgeprägt. Buntpapieren,,,1,02
997934581,L-1740-165313161,Aal,DBSM/F/Bö,Bö C V 733,Bö C V 733,1740,"Das @Angedencken des dritten Jubel-Fests der edlen Buchdrucker-Kunst auf der Universität Tübingen, welches theils wie dieses Jubel-Fest ... 1740 am Ta", : ,,,,,,,,Schenkg Kirchhoff 1875,,,1,02
997971347,L-1733-165362375,Aal,DBSM/F/Bö,Bö B III 1385 a,Bö B III 1385 a,1733,"Joh[annis] Hieron[ymi] Kniphofs Antwort auf Herrn Franc[isci] Ernest [i] Brückmanns Send-Schreiben, die Kräuter nach dem Leben abzudrucken und dieselb", : ,,,,,,,,Schenkg Kirchhoff,,,1,02
997973293,L-1754-165365072,Afl,DBSM/F/Bö,Bö F III 376,Bö F III 376,1754,Historisch-critische Nachrichten von der braunschweigischen Bibelsammlung,Bd. 1. : 1. - 10. Stck nebst e. Anh. u. doppelten Reg.,,,,,,,,,,,1,02
997973420,L-1736-16536520X,Aal,DBSM/F/Bö,Bö C VII 2674/4°,Bö C VII 2674/4°,1736,Extractus einiger in der bekandten Knochischen Filiations-Sache zu Franckfurth am Mayn biß daher hinc inde beygebrachter und zur Zeit communicable gew, : ,,,,,,,,,,,1,02
997981393,L-1740-16537411X,Aal,DBSM/F/Bö,Bö C V 85,Bö C V 85,1740,"Historischer Abriß von dem Anfang und Wachsthum der Gelehrsamkeit in Ober-Lausitz, und wie die Ober-Lausitzschen Buchdruckereyen derselben gedienet : ", : ,,,,,,,,Schenkg Kirchhoff,,,1,02
99798242X,L-1740-165375361,Aal,DBSM/F/Bö,Bö C V 86,Bö C V 86,1740,Annales typographici Lusatiae superioris oder Geschichte der Ober-Lausitzischen Buchdruckereyen ... : Als ein Beytr. zu der Buchdrucker-Historie mitge, : ,,,,,,,,Schenkg Kirchhoff,,,1,02
997982934,L-1759-165376074,Aal,DBSM/F/Bö,Bö C V 87,Bö C V 87,1759,"Von denen Schulbüchern, welche in denen oberlausitzischen Schulen vor der Reformation Lutheri gebraucht worden : [Hochzeitspredigt bei dem Geißlerisch", : ,,,,,,,,Schenkg Kirchhoff; 1472,,,1,02
997988193,L-1740-165381345,Aal,DBSM/F/Bö,Bö C V 143,Bö C V 143,1740,De Palingenesia litterarum : Oratio anniversaria memoriae [J. G.] Zangianae cumprimis sacra et hac occasione vigentibus impraesentiarum Typographiae i, : ,,,,,,,,,,,1,02
997991771,L-1811-165385502,Aal,DBSM/F/Bö,Bö G I 105,Bö G I 105,1811,Geschichte und Merkwürdigkeiten der Rathsbibliothek in Zittau : , : ,,,,,,,,,,,1,02
998007390,L-1741-165398965,Aal,DBSM/F/Bö,Bö C IV 61,Bö C IV 61,1741,"Hochverdiente und aus bewährten Urkunden wohlbeglaubte Ehren-Rettung Johann Guttenbergs, eingebohrnen Bürgers in Mayntz, aus dem alten Rheinländ. Adel", : ,,,,,,,,,,,1,02
998007897,L-1728-165399449,Aal,DBSM/F/Bö,Bö G II 140,Bö G II 140,1728,Sylloge aliquot scriptorum de bene ordinanda et ornanda bibliotheca : , : ,,,,,,,,,,,1,02
998008737,L-1794-165400129,Afl,DBSM/F/Bö,Bö C II 3,Bö C II 3,1794,Lebensbeschreibungen merkwürdiger deutscher Gelehrten und Künstler besonders des berühmten Malers Lucas Kranachs,1 : ,,,,,,,,,,,1,02
998018112,L-1541-165446285,Aal,DBSM/F/Bö,Bö E IV 1041,Bö E IV 1041,1541,Processus vnd Practica der gerichtsleuff||te|| nach dem  gebrauch Sech||sischer Landart|| aus der gemei||nen Bäpstlichen|| Keiserlichen vnd Sechsische, : ,,,,,,,,[Kupferstich-Exlibris d. Carl. Ferd. Hommel]. - zeitgenöss. Ebd.,,,1,02
998025321,L-1818-165453818,Afl,DBSM/F/Bö,Bö C IV 238,Bö C IV 238,1818,Bijdragen tot de geschiedenis der boekdrukkunst,[1] : ,,,,,,,,Schenkg Kirchhoff,,,1,02
998025399,L-1781-165453893,Aal,DBSM/F/Bö,Bö B I 527,Bö B I 527,1781,Vorübungen in der Kalligraphie : , : ,,,,,,,,Pergmtbd. m. fürstl. Superexlibris in Vergoldg.,,,1,02
998025461,L-1818-165453958,Afl,DBSM/F/Bö,Bö C IV 238,Bö C IV 238,1818,Bijdragen tot de geschiedenis der boekdrukkunst,2 : ,,,,,,,,Schenkg Kirchhoff,,,1,02
998025860,L-1819-165454393,Aal,DBSM/F/Bö,Bö C IV 240,Bö C IV 240,1819,"Dissertation sur l'origine, l'invention et le perfectionnenment de l'imprimerie  : ", : ,,,,,,,,,,,1,02
998032778,L-1816-165461535,Aal,DBSM/F/Bö,Bö C IV 239,Bö C IV 239,1816,"Verhandeling over den oorsprong, de uitvinding verbetering en volmaking der boekdrukkunst : ", : ,,,,,,,,,,,1,03
998033863,L-1820-165462698,Afl,DBSM/F/Bö,Bö E IV 435,Bö E IV 435,1820,Vertraute Briefe über Bücher und Welt,[1] : ,,,,,,,,,,,1,02
998033987,L-1823-165462833,Afl,DBSM/F/Bö,Bö E IV 435,Bö E IV 435,1823,Vertraute Briefe über Bücher und Welt,2 : ,,,,,,,,,,,1,02
998033987,L-1823-165462841,Afl,DBSM/F/Bö,Bö E IV 435 a,Bö E IV 435 a,1823,Vertraute Briefe über Bücher und Welt,2 : ,,,,,,,,,,,1,03
998034533,L-1819-16546349X,Aal,DBSM/F/Bö,Bö E IV 434,Bö E IV 434,1819,Rechtslehre nach platonischen Grundsätzen mit Anwendung auf unsere Zeit : , : ,,,,,,,,,,,1,02
998043613,L-1815-165474505,Aal,DBSM/F/Bö,Bö E IV 438,Bö E IV 438,1815,Ueber Preßfreiheit : ein Turn-Schreiben an alle Verfechter des Preßzwangs, : ,,,,,,,,,,,1,02
998054143,L-1820-165498471,Aal,DBSM/F/Bö,Bö B III 1080,Bö B III 1080,1820,Practische Anleitung zur Lithographie : mit d. Abb. ein. Steindruckpresse, : ,,,,,,,,,,,1,03
998070564,L-1791-16551938X,Afl,DBSM/F/Bö,Bö C VIII 681,Bö C VIII 681,1791,"Manuel de la littérature françoise, italienne, angloise et d'autretes langues étrangères dont l'apparat se trouve au magazin du libraire Jean Frédéric",2 : ,,,,,,,,,,,1,02
998070629,L-1791-165519460,Afl,DBSM/F/Bö,Bö C VIII 681,Bö C VIII 681,1791,"Manuel de la littérature françoise, italienne, angloise et d'autretes langues étrangères dont l'apparat se trouve au magazin du libraire Jean Frédéric",3 : ,,,,,,,,,,,1,02
998070653,L-1792-165519495,Afl,DBSM/F/Bö,Bö C VIII 681,Bö C VIII 681,1792,"Manuel de la littérature françoise, italienne, angloise et d'autretes langues étrangères dont l'apparat se trouve au magazin du libraire Jean Frédéric",4 : ,,,,,,,,,,,1,02
998070688,L-1792-165519525,Afl,DBSM/F/Bö,Bö C VIII 681,Bö C VIII 681,1792,"Manuel de la littérature françoise, italienne, angloise et d'autretes langues étrangères dont l'apparat se trouve au magazin du libraire Jean Frédéric",5 : ,,,,,,,,,,,1,02
998070726,L-1793-165519584,Afl,DBSM/F/Bö,Bö C VIII 681,Bö C VIII 681,1793,"Manuel de la littérature françoise, italienne, angloise et d'autretes langues étrangères dont l'apparat se trouve au magazin du libraire Jean Frédéric",6 : ,,,,,,,,,,,1,02
998070742,L-1793-165519606,Afl,DBSM/F/Bö,Bö C VIII 681,Bö C VIII 681,1793,"Manuel de la littérature françoise, italienne, angloise et d'autretes langues étrangères dont l'apparat se trouve au magazin du libraire Jean Frédéric",7 : ,,,,,,,,,,,1,02
998070785,L-1794-165519673,Afl,DBSM/F/Bö,Bö C VIII 681,Bö C VIII 681,1794,"Manuel de la littérature françoise, italienne, angloise et d'autretes langues étrangères dont l'apparat se trouve au magazin du libraire Jean Frédéric",8 : ,,,,,,,,,,,1,02
998070807,L-1794-165519711,Afl,DBSM/F/Bö,Bö C VIII 681,Bö C VIII 681,1794,"Manuel de la littérature françoise, italienne, angloise et d'autretes langues étrangères dont l'apparat se trouve au magazin du libraire Jean Frédéric",9 : ,,,,,,,,,,,1,02
99807084X,L-1795-165519762,Afl,DBSM/F/Bö,Bö C VIII 681,Bö C VIII 681,1795,"Manuel de la littérature françoise, italienne, angloise et d'autretes langues étrangères dont l'apparat se trouve au magazin du libraire Jean Frédéric",10 : ,,,,,,,,,,,1,02
998070882,L-1795-165519800,Afl,DBSM/F/Bö,Bö C VIII 681,Bö C VIII 681,1795,"Manuel de la littérature françoise, italienne, angloise et d'autretes langues étrangères dont l'apparat se trouve au magazin du libraire Jean Frédéric",11 : ,,,,,,,,,,,1,02
998070947,L-1796-165519843,Afl,DBSM/F/Bö,Bö C VIII 681,Bö C VIII 681,1796,"Manuel de la littérature françoise, italienne, angloise et d'autretes langues étrangères dont l'apparat se trouve au magazin du libraire Jean Frédéric",12 : ,,,,,,,,,,,1,02
998070971,L-1796-165519908,Afl,DBSM/F/Bö,Bö C VIII 681,Bö C VIII 681,1796,"Manuel de la littérature françoise, italienne, angloise et d'autretes langues étrangères dont l'apparat se trouve au magazin du libraire Jean Frédéric",13 : ,,,,,,,,,,,1,02
99807103X,L-1797-165519983,Afl,DBSM/F/Bö,Bö C VIII 681,Bö C VIII 681,1797,"Manuel de la littérature françoise, italienne, angloise et d'autretes langues étrangères dont l'apparat se trouve au magazin du libraire Jean Frédéric",14 : ,,,,,,,,,,,1,02
998077623,L-1819-165532327,Afl,DBSM/F/Bö,Bö B I 21,Bö B I 21,1819,Bilder und Schriften der Vorzeit,[Bd. 1.] : ,,,,,,,,,,,1,02
998077666,L-1819-165532378,Afl,DBSM/F/Bö,Bö B I 21,Bö B I 21,1819,Bilder und Schriften der Vorzeit,Bd. 2 : ,,,,,,,,,,,1,02
998078115,L-1796-165532874,Aal,DBSM/F/Bö,Bö F III 141,Bö F III 141,1796,Versuchte Darstellung einer alphabetischen Folge der mecklenburgischen Schriftsteller älterer und neuer Zeit : Nebst e. Vorrede v. d. Quellen e. v. ih, : ,,,,,,,,"Mit eigenh. Widmung d. Verf. f. Prof. Cordes, Kiel",,,1,02
998078298,L-1816-165837586,Aal,DBSM/F/Bö,Bö F III 142,Bö F III 142,1816,Mecklenburgs Schriftsteller von den ältesten Zeiten bis jetzt ... in alphabet. Folge : Nebst ... Plan e ... allgemeinen Mecklenburgischen Schriftstell, : ,,,,,,,,,,,1,03
998079766,L-1740-165534583,Aal,DBSM/F/Bö,Bö C IV 247,Bö C IV 247,1740,"Jakob Kortebrants Lof der drukkunste, te Haerlem uitgevonden door Laurens Janszoon Koster, ontrent het jaer 1440 ; op haer derde eeuwgetyde ; met nodi", : ,,,,,,,,,,,1,02
99810891X,L-1827-165599774,Aal,DBSM/F/Bö,Bö B III 398,Bö B III 398,1827,Handbuch der Buchdruckerkunst : , : ,,,,,,,,,,,1,02
998301035,L-1741-165776684,Aal,DBSM/F/Bö,Bö C V 115,Bö C V 115,1741,"G. C. Kreysigs Nachlese zum Buchdrukker-Jubilaeo in Ober-Sachsen oder Historie derer ehemahl. Buchdrucker zu Altenburg, Annaberg, Freyberg, Pirna und ", : ,,,,,,,,Schenkg Kirchhoff,,,1,02
998323373,L-1816-165800755,Aal,DBSM/F/Bö,Bö E IV 67,Bö E IV 67,1816,Entwurf zu einer allgemeinen Gesetzgebung über die Preßfreiheit in Deutschland : , : ,,,,,,,,,,,1,02
998323683,L-1820-165801107,Aal,DBSM/F/Bö,Bö C V 509,Bö C V 509,1820,"Apollo der Leukopeträer : Ein Beitr. zur griech. Anthologie, enthaltend 6 bischer unbekannte alte Gedichte", : ,,,,,,,,Im Orig.-Broschurumschl.,,,1,02
998378143,L-1790-166122564,Aal,DBSM/F/Bö,Bö B III 1017,Bö B III 1017,1790,Die @Kupferstecher-Kunst : , : ,,,,,,,,,,,1,02
99838626X,L-1820-16613077X,Aal,DBSM/F/Bö,Bö E IV 1147,Bö E IV 1147,1820,Opinion de M. de Lafayette sur la censure de la presse : , : ,,,,,,,,,,,1,02
998388599,L-1762-166133329,AFl,DBSM/F/Bö,Bö B II 21 (Großformate),Bö B II 21,1762,Art de faire le parchemin : , : ,,,,,,,,Stiftung Kirchhoff,,,1,02
998389021,L-1767-16613385X,Aal,DBSM/F/Bö,Bö B V 191,Bö B V 191,1767,"Die @Kunst, Saffianleder zu bereiten : ", : ,,,,,,,,,,,1,02
998389080,L-1689-166133922,Aal,DBSM/F/Bö,Bö C II 4,Bö C II 4,1689,"Histoire de l'imprimerie et de la librairie, où l'on voit son origine et son progrès, jusqu'en 1689 : ", : ,,,,,,,,,,,1,02
99839002X,L-1820-166135003,Aal,DBSM/F/Bö,Bö B II 124/4°,Bö B II 124/4°,1820,Art de faire le papier : , : ,,,,,,,,,,,1,02
998393096,L-1740-166138622,Aal,DBSM/F/Bö,Bö C IV 352,Bö C IV 352,1740,"Adami Henrici Lackmanni Annalium typographicorum, selecta quaedam capita : ", : ,,,,,,,,,,,1,02
998403105,L-1810-166164720,Afl,DBSM/F/Bö,Bö C IV 70,Bö C IV 70,1810,"Origine de l'imprimerie d'après les titres authentiques, l'opinion de Daunou et celle de van Praet, suivie des établissemens de cet art dans la Belgiq",1 : ,,,,,,,,,,,1,02
998403156,L-1810-166164771,Afl,DBSM/F/Bö,Bö C IV 70,Bö C IV 70,1810,"Origine de l'imprimerie d'après les titres authentiques, l'opinion de Daunou et celle de van Praet, suivie des établissemens de cet art dans la Belgiq",2 : ,,,,,,,,,,,1,02
998403512,L-1799-166165131,Aal,DBSM/F/Bö,Bö C IV 69,Bö C IV 69,1798,"Recherches historiques, littéraires et critiques, sur l'origine de l'imprimerie : particulièrement sur ses premiers établissemens, au 15me siècle, dan", : ,,,,,,,,,,,1,02
998405787,L-1791-166167673,Afl,DBSM/F/Bö,Bö F III 61,Bö F III 61,1791,Index librorum ab inventa typographia ad annum 1500,1 : ,,,,,,,,Schenkg Kirchhoff,,,1,03
998407240,L-1766-174993412,Aal,DBSM/F/Bö,Bö B II 125,Bö B II 125,1766,Die @Kunst Papier zu machen : , : ,,,,,,,,,,,1,03
998420476,L-1778-166182621,Aal,DBSM/F/Bö,Bö B II 167,Bö B II 167,1778,"Arte de hacer el papel, segun se practica en Francia y Holanda, en la China, y en el Japon : ", : ,,,,,,,,,,,1,02
998423769,L-1740-166186473,Aal,DBSM/F/Bö,Bö C IV 248,Bö C IV 248,1740,"De @eeuwigduurende Lamp : Ontstooken voor het beeltenis van Laurens Koster, mitsgaders de uitbreiding en verklaaringe van de zeer uitmuntende gedenk-p", : ,,,,,,,,,,,1,02
998427365,L-1740-16619056X,Aal,DBSM/F/Bö,Bö C V 169,Bö C V 169,1740,"Die @Buchdrucker-Kunst als das letzte und edelste Kleinod der Kirche, am 3. Buchdrucker-Jubel-Feste ... den 19.7.1740 in Budißin gepriesen : ", : ,,,,,,,,Schenkg Kirchhoff,,,1,02
998429988,L-1681-166193720,Aal,DBSM/F/Bö,Bö B I 79,Bö B I 79,1681,"L' @Art de verifier où sont enseignés les veritables moyens de découvrir les faussetés des écritures, & la maniere d'en faire de bons rapports, par la", : ,,,,,,,,,,,1,02
998432431,L-1768-166196487,Aal,DBSM/F/Bö,Bö D VII 881,Bö D VII 881,1768,Catalogus scriptorum Christ. Aug. Crusii [Christian August Krause] S. Theologiae Doctoris in Acad. Lips. Prof. Prim. ... quae apud Johann Friedrich La, : ,,,,,,,,,,,1,02
998432571,L-1765-166196665,Aal,DBSM/F/Bö,Bö D VII 882,Bö D VII 882,1765,Catalogus scriptorum Io. Avg. Ernesti S. S. Theologiae Doctoris rel. quae prostant apvd Io. Frid. Langenhemium : , : ,,,,,,,,[Mit hs. Anmerkgn v. Leipziger Antiquar Thiermann],,,1,02
998432989,L-1740-166197084,Aal,DBSM/F/Bö,Bö C V 640/4°,Bö C V 640/4°,1740,"Das @dem grossen Gott zu Ehren, bey feyerlicher Begehung des dritten Jubel-Festes, der vor dreyhundert Jahren in Teutschland erfundenen edlen Buchdruc", : ,,,,,,,,,,,1,02
99843325X,L-1791-166197343,Afl,DBSM/F/Bö,Bö B III 23,Bö B III 23,1791,"Briefe für Maler, Zeichner, Formschneider, Kupferstecher und Bildhauer, welchen daran gelegen ist, sich über den bloßen Handwerker empor zu heben, und",1 : ,,,,,,,,,,,1,02
998433284,L-1792-166197386,Afl,DBSM/F/Bö,Bö B III 23,Bö B III 23,1792,"Briefe für Maler, Zeichner, Formschneider, Kupferstecher und Bildhauer, welchen daran gelegen ist, sich über den bloßen Handwerker empor zu heben, und",2 : ,,,,,,,,,,,1,02
998434620,L-1822-166198560,Aal,DBSM/F/Bö,Bö H 75/2,Bö H 75/2,1822,"Gewählte Auszüge aus den neuesten und besten englischen Dichtern und Prosaisten, mit beygefügter wörlicher Uebersetzung und genauer Angabe der Ausspra", : ,,,,,,,,,,,1,02
998437921,L-1830-166222380,Aal,DBSM/F/Bö,Bö E IV 439,Bö E IV 439,1830,De la Liberté de la presse illimitée : Considérée sous le rapport de la responsabilité légale des écrits après leur publication et sous celui de la no, : ,,,,,,,,,,,1,02
998439118,L-1820-166223654,Aal,DBSM/F/Bö,Bö E IV 1148,Bö E IV 1148,1820,"Cinq Discours de Lanjuinais, prononcés en la Chambre des Pairs, pour faire conserver 1. la liberté individuelle; 2. la liberté de la presse ou des jou", : ,,,,,,,,,,,1,02
998442755,L-1726-166227080,Aal,DBSM/F/Bö,Bö C IV 249,Bö C IV 249,1726,"Laurier-krans, gevlogten om't hoofd van Laurens Koster, eerste uitvinder der boekdrukkunst binnen Haarlem : ", : ,,,,,,,,,,,1,02
998444715,L-1793-166229407,Afl,DBSM/F/Bö,Bö F III 18,Bö F III 18,1793,Bibliographie interessanter und gemeinnütziger Kenntnisse,"1. : Statistic, Politik u. damit verwandte Gegenstände",,,,,,,,Schattenriss fehlt,,,1,02
998444766,L-1795-16622944X,Afl,DBSM/F/Bö,Bö F III 18,Bö F III 18,1795,Bibliographie interessanter und gemeinnütziger Kenntnisse,"2. : Statistic, Politik u. damit verwandte Gegenstände",,,,,,,,,,,1,02
998447129,L-1820-16623186X,Aal,DBSM/F/Bö,Bö C IV 332,Bö C IV 332,1820,Over den voortgang en de verbreiding der boekdrukkunst in de XV en XVI eeuw : eene prijsverhandeling ter beantwoording der vraag: Geschiedkundig overz, : ,,,,,,,,,,,1,02
998466840,L-1740-166252050,Afl,DBSM/F/Bö,Bö D VII 851,Bö D VII 851,1740,"Lebens- und Regierungs-Geschichte der Brandenburgischen Churfürsten aus dem Hohenzollerischen Hause, nebst deren Bildnisse in Kupferstich von Frideric",[1] : ,,,,,,,,2 fehlt,,,1,02
998484369,L-1756-166364177,Aal,DBSM/F/Bö,Bö B III 1028,Bö B III 1028,1756,"L' @art d'imprimer les tableaux : traité d'après les écrits, les opérations et les instructions verbales", : ,,,,,,,,,,,1,03
998484520,L-1769-166364320,Afl,DBSM/F/Boe,Bö E IV 36,Bö E IV 36,1769,"Pragmatische Geschichte der so berufenen Bulle In Coena Domini und ihren fürchterlichen Folgen für den Staat und die Kirche, zur Beurtheilung aller St",1. : Die Geschichte der Grundsätze dieser Bulle,,,,,,,,,,,1,02
998484547,L-1769-166364347,Afl,DBSM/F/Bö,Bö E IV 36,Bö E IV 36,1769,"Pragmatische Geschichte der so berufenen Bulle In Coena Domini und ihren fürchterlichen Folgen für den Staat und die Kirche, zur Beurtheilung aller St",2. : Die Geschichte vor der Entstehungs-Art dieser Bulle,,,,,,,,,,,1,02
998484555,L-1770-166364355,Afl,DBSM/F/Bö,Bö E IV 36,Bö E IV 36,1770,"Pragmatische Geschichte der so berufenen Bulle In Coena Domini und ihren fürchterlichen Folgen für den Staat und die Kirche, zur Beurtheilung aller St",3. : Die Geschichte vor der Fortdauer dieser Bulle,,,,,,,,,,,1,02
998484571,L-1770-166364371,Afl,DBSM/F/Bö,Bö E IV 36,Bö E IV 36,1770,"Pragmatische Geschichte der so berufenen Bulle In Coena Domini und ihren fürchterlichen Folgen für den Staat und die Kirche, zur Beurtheilung aller St",4. : Die Geschichte von den neuesten Wirkung der Bulle u. den letzern Widersprüchen wider dieselbe,,,,,,,,,,,1,02
998491403,L-1796-166371874,Aal,DBSM/F/Bö,Bö F I 92,Bö F I 92,1796,Mémoire sur l'origine et le premier usage des signatures et des chiffres dans l'art typographique : communiqué à un ami, : ,,,,,,,,,,,1,02
998491527,L-1680-166372021,Aal,DBSM/F/Bö,Bö G II 19,Bö G II 19,1680,"Traitté des plus belles bibliothèques de l'Europe : des premiers livres qui ont été faits ; de l'invention de l'imprimerie, des imprimeurs ; de plusie", : ,,,,,,,,,,,1,02
998491802,L-1685-166372269,Aal,DBSM/F/Bö,Bö G II 20,Bö G II 20,1685,"Traitté des plus belles bibliothèques de l'Europe : des premiers livres qui ont été faits, de l'invention de l'imprimerie ... avec une méthode pour dr", : ,,,,,,,,,,,1,02
998493422,L-1745-166373915,Aal,DBSM/F/Bö,Bö F III 867/2°,Bö F III 867/2°,1745,"Lebens-Beschreibung des hochedelgebohrnen Herrn Eucharius Gottlieb Rinks, Erb-, Lehn- und Gerichts-Herrns auf Stötteriz, Weyl : Ihro Röm. Kays. Majest", : ,,,,,,,,,,,1,02
998494437,L-1746-166375020,Aal,DBSM/F/Bö,Bö G II 21,Bö G II 21,1746,"Oliverii Legipontii, ... Dissertationes philologico-bibliographicae, in quibus de adornanda, & ornanda bibliotheca; nec non de manuscriptis, librisque", : ,,,,,,,,,,,1,02
998495212,L-1740-166459496,Aal,DBSM/F/Bö,Bö C V 457,Bö C V 457,1740,"De Origine et incrementis typographiae Lipsiensis liber singularis, ubi varia de litteraris urbis studiis et viris doctis, qui in ea claruerunt, inser", : ,,,,,,,,,,,1,03
998495212,L-1740-16637587X,Aal,DBSM/F/Bö,Bö C V 458,Bö C V 458,1740,"De Origine et incrementis typographiae Lipsiensis liber singularis, ubi varia de litteraris urbis studiis et viris doctis, qui in ea claruerunt, inser", : ,,,,,,,,Mit hs. Zusätzen,,,1,04
998495212,L-1740-166459534,Aal,DBSM/F/Bö,Bö C V 459,Bö C V 459,1740,"De Origine et incrementis typographiae Lipsiensis liber singularis, ubi varia de litteraris urbis studiis et viris doctis, qui in ea claruerunt, inser", : ,,,,,,,,Mit hs. Namenregister von G. E. Gersdorf u. hs. Zusätzen,,,1,05
998495719,L-1665-166376213,Aal,DBSM/F/Bö,Bö C V 205,Bö C V 205,1665,Leich-Abdanckungen denen erlauchten fürstlichen Personen: gehalten von vornehmen Politicis : , : ,,,,,,,,Schenkg Kirchhoff,,,1,02
998515167,L-1709-166396974,Afl,DBSM/F/Bö,Bö F III 380,Bö F III 380,1709,Bibliotheca sacra seu syllabus omnium ferme sacrae scripturae editionum ac versionum secundum seriem linguarum quibus vulgatae sunt ... Labore ...,1 : ,,,,,,,,,,,1,02
998515183,L-1709-166397016,Afl,DBSM/F/Bö,Bö F III 380,Bö F III 380,1709,Bibliotheca sacra seu syllabus omnium ferme sacrae scripturae editionum ac versionum secundum seriem linguarum quibus vulgatae sunt ... Labore ...,2 : ,,,,,,,,,,,1,02
99851540X,L-1719-166397229,Aal,DBSM/F/Bö,Bö F III 514/2°,Bö F III 514/2°,1719,"Bibliothèque historique de la France : contenant le catalogue de tous les ouvrages, tant impriméz que manuscrits, qui traitent de l'histoire de ce roi", : ,,,,,,,,,,,1,02
998515809,L-1732-166397660,Aal,DBSM/F/Bö,Bö C V 811,Bö C V 811,1732,"Boek-Zaal der nederduytsche Bybels ... Doormengt met historische, taalkundige, geestelyke en wereldtlyke aanmerkingen ... : ", : ,,,,,,,,Vor d. Widmg. Kupf. Vign. v. Jan. Ruyter,,,1,02
998516562,L-1740-166398470,Aal,DBSM/F/Bö,Bö C V 404,Bö C V 404,1740,"Gepriesenes Andencken von Erfindung der Buchdruckerey, wie solches in Leipzig beym Schluß des dritten Jahrhunderts von den gesammten Buchdruckern dase", : ,,,,,,,,Dieser Ausg. ist kein weiteres Werk angebunden,,,1,02
99851764X,L-1743-166399701,Aal,DBSM/F/Bö,Bö G II 21,Bö G II 21,1743,"De Diptycha veterum, et de diptycho eminentissimi Quirini, S. R. E. cardinalis, bibliothecarii Apostolici, episcopi Brixiensis, diatribe : ", : ,,,,,,,,"Ausg. ohne 2 Kupf.-Taf., stark beschnitten",,,1,02
99851764X,L-1743-166459100,Aal,DBSM/F/Bö,Bö B I 183/4°,Bö B I 183/4°,1743,"De Diptycha veterum, et de diptycho eminentissimi Quirini, S. R. E. cardinalis, bibliothecarii Apostolici, episcopi Brixiensis, diatribe : ", : ,,,,,,,,Schenkung Kirchhoff; Dieser Ausg. ist kein weiteres Werk angebunden,,,1,03
998538108,L-1799-16646547X,Aal,DBSM/F/Bö,Bö C V 461,Bö C V 461,1799,Geschichte und Beschreibung der Kreis- und Handelsstadt Leipzig nebst der umliegenden Gegend : mit einem Plane u. Tit. Kupf. (v. C. Schule nach Schnor, : ,,,,,,,,,,,1,02
998552178,L-1830-166478946,Aal,DBSM/F/Bö,Bö B II 193,Bö B II 193,1830,"Manuel du fabricant d'étoffes imprimées et du fabricant de papiers peints, contenant les procédés les plus nuveaux[!] pour imprimer les étoffes de cot", : ,,,,,,,,,,,1,02
998553425,L-1752-166480266,Aal,DBSM/F/Bö,Bö B I 390,Bö B I 390,1752,"Nouveau Livre d'Écriture pour apprendre de soimême à écrire, à dresser des mémoires de depense et autres et la nouvelle manière de dresser des Lettres", : ,,,,,,,,Bl. 14 fehlt!,,,1,02
998555762,L-1827-166482706,Aal,DBSM/F/Bö,Bö B V 153,Bö B V 153,1827,"Manuel du relieur, dans toutes ses parties : Précédé des arts de l'assembleur, de la plieuse, de la brocheuse, et suivi des arts du marbreur sur tranc", : ,,,,,,,,Schenkg Kirchhoff,,,1,02
998557366,L-1740-166484334,Aal,DBSM/F/Bö,Bö C V 1107,Bö C V 1107,1740,"Kort Berättelse om bok-tryckeriets begynnelse och fortgång, i gemen och äfwen uti Sverige, då åhr ... 1740, des 3. jubilaeum uti Europa firades : ", : ,,,,,,,,Schenkg Kirchhoff 1875,,,1,02
